Sentence,Label
"“Prova estrema su TikTok"":",OBJ
"bambina di 10 anni in coma a Palermo, dichiarata la morte cerebrale.",OBJ
Inchiesta per istigazione al suicidio.,OBJ
Una bambina di 10 anni è ricoverata in rianimazione all’ospedale Di Cristina di Palermo dov’è arrivata accompagnata dai genitori in arresto cardiocircolatorio dovuto a una asfissia prolungata.,OBJ
I medici hanno dichiarato la morte cerebrale e i genitori hanno acconsentito all’espianto degli organi.,OBJ
Secondo quanto è stato ricostruito finora la ragazzina si è sentita male durante una prova estrema di soffocamento su TikTok.,OBJ
In particolare la ragazzina si trovava in bagno e si sarebbe legata una cintura di accappatoio alla gola.,OBJ
Sempre per quanto viene ricostruito al momento il cuore della bambina si è fermato per alcuni minuti prima di ricominciare a battere grazie alle manovre rianimatorie eseguite dal personale sanitario arrivato dopo la chiamata al 118.,OBJ
"La magistratura ha aperto due fascicoli d’inchiesta, uno alla Procura ordinaria e un altro alla Procura dei minori che procede per istigazione al suicidio contro ignoti.",OBJ
A riferire della sfida di TikTok sono stati i genitori in ospedale ma la squadra mobile della questura di Palermo – che ha sequestrato il cellulare della bambina – sta indagando a 360 gradi insieme alla polizia postale.,OBJ
Un portavoce di TikTok ha commentato quanto è accaduto a Palermo:,OBJ
“Siamo davanti ad un evento tragico e rivolgiamo le nostre più sincere condoglianze e pensieri di vicinanza alla famiglia e agli amici di questa bambina.,SUBJ
"La sicurezza della community TikTok è la nostra priorità assoluta, siamo a disposizione delle autorità competenti per collaborare alle loro indagini"".",SUBJ
"Secondo una prima ricostruzione la piccola avrebbe raccolto la sfida che sulla app viene chiamata “hanging challenge"" e che prevede una prova di resistenza.",OBJ
"La sfida, per quanto si faccia fatica a comprenderla, consiste nello stringersi una cintura attorno al collo e resistere il più possibile.",SUBJ
"La piccola avrebbe seguito i vari passaggi prima di restare asfissiata, trovandosi poi senza forze e crollando per terra.",OBJ
Quando i genitori della bambina si sono accorti della situazione hanno liberato la figlia dalla cintura e l’hanno trasportato al pronto soccorso dell’ospedale pediatrico.,OBJ
Il quadro clinico della piccola è apparso subito gravissimo.,OBJ
La direzione sanitaria si è messa subito in contatto con le forze dell’ordine e con la magistratura che dovrà ricostruire la dinamica dell’incidente e chiarire i contorni della vicenda.,OBJ
"Vaccino anti-Covid, nuovi ritardi di Pfizer nella consegna. ",OBJ
Martedì incontro tra governo e Regioni: si studia meccanismo di solidarietà.,OBJ
Un nuovo cambio di programma deciso unilateralmente da Pfizer nella consegna dei vaccini anti-Covid destinati all’Italia.,OBJ
"La casa farmaceutica statunitense ha consegnato oggi nel nostro Paese circa 103mila delle 397mila previste per questa settimana, dopo il taglio di 165mila deciso venerdì. ",OBJ
Martedì ne arriveranno solo 53.820 e solo mercoledì le restanti 241mila.,OBJ
La comunicazione è stata data dalla Pfizer alle 17 agli uffici del commissario straordinario per l’emergenza Coronavirus Domenico Arcuri spiegando che il ritardo è dovuto al nuovo piano di distribuzione per le prossime settimane.,OBJ
"Arcuri parla di un “ulteriore incredibile ritardo"" deplorando la decisione della casa farmaceutica statunitense. ",OBJ
"Per far fronte alla nuova situazione martedì ci sarà una riunione con le Regioni, che hanno già scritto al commissario chiedendo in intervento, e una delle ipotesi sul tavolo è quella di mettere a punto una sorta di ‘meccanismo di solidarietà’ in base al quale chi ha più dosi nei magazzini le cederebbe alle Regioni che ne hanno meno e devono fare i richiami. ",OBJ
Il vertice è stato convocato dal ministro degli Affari regionali Francesco Boccia.,OBJ
"All’incontro, in programma alle 20, partecipano anche il ministro della Salute Roberto Speranza e lo stesso Arcuri.",OBJ
La tabella di marcia è quindi a rischio.,SUBJ
"Il ritardo potrebbe dunque pesare sull’avvio della fase 2 della campagna, nella quale la priorità per l’immunizzazione dovrebbe essere garantita innanzitutto ad anziani over-80 ma anche ad una prima quota di 400.000 pazienti oncologici, ematologici e cardiologici. ",SUBJ
"Dopo il personale sanitario e gli ospiti delle Rsa, e mentre le richieste di accesso prioritario all’immunizzazione si moltiplicano, anche ad esempio per insegnanti ed altre categorie sensibili, sembra dunque confermato che proprio anziani e pazienti più fragili apriranno la fase 2 della campagna vaccinale in atto. ",OBJ
OBJ,OBJ
"ha sottolineato il viceministro alla Salute Pierpaolo Sileri, intervenuto ad una conferenza stampa on line organizzata dalla Fondazione Insieme contro il Cancro sui test genomici nella cura del cancro al seno.",OBJ
"Dritto e Rovescio, Antonio Maria Rinaldi asfalta Gaetano Pedullà.",SUBJ
Peggiore in assoluto,SUBJ
la sparata sui morti,SUBJ
"Altro botta e risposta a Dritto e Rovescio, il programma di Paolo Del Debbio in onda su Rete 4.",OBJ
"Da una parte Antonio Maria Rinaldi, dall'altra Gaetano Pedullà.",OBJ
"Il primo accusa il governo per la pessima gestione del coronavirus, il secondo punta il dito contro l'opposizione. ",OBJ
Abbiamo il record mondiale di morti,OBJ
tuona il leghista mentre il direttore de La Notizia replica,OBJ
Voi non avete fatto nulla per aiutarli.,SUBJ
Ma Rinaldi non indietreggia,OBJ
Voi siete il governo peggiore in assoluto.,SUBJ
Sei un disco.,SUBJ
Mi rispondi?,OBJ
"Pedullà in evidente difficoltà nel salotto di Del Debbio, si arrampica sugli specchi ",SUBJ
Abbiamo un alto numero di morti solo perchè siamo stati i primi investiti della pandemia.,SUBJ
"Eppure, come ricorda il leghista, la crisi non è solo sanitaria ma anche economica. ",OBJ
E cosa si è fatto?,OBJ
si chiede Rinaldi senza ottenere risposta.,OBJ
La Cina sanziona gli uomini di Trump.,OBJ
"Ricordate quel vecchio detto “la vendetta è un piatto che va consumato freddo""? ",OBJ
"Beh, sembra proprio che a Pechino lo abbiano tenuto caro.",SUBJ
"Con un comunicato del portavoce del ministro degli esteri, i cinesi hhano reso noto ieri di aver deciso sanzioni contro una trentina di ex esponenti dell’amministrazione Trump. ",OBJ
Cogliendo l’attimo esatto della maggior riprovazione per l’operato di The Donald anche all’interno degli Stati Uniti.,SUBJ
"E dunque sottraendosi, almeno nell’immediato, all’ipotesi di ritorsioni.",OBJ
Questo il testo:,OBJ
"“Negli ultimi anni, negli Stati Uniti, alcuni politici anti-Cina, per i loro interessi politici egoistici, per il loro pregiudizio e odio contro la Cina e senza mostrare alcun riguardo per gli interessi dei popoli cinese e americano, hanno pianificato, promosso ed eseguito una serie di mosse folli che hanno gravemente interferito negli affari interni della Cina, minato gli interessi della Cina, offeso il popolo cinese, e seriamente disturbato le relazioni Cina-USA.",SUBJ
"Il governo cinese è fermamente deciso a difendere la sovranità nazionale, la sicurezza e gli interessi di sviluppo della Cina.",OBJ
La Cina ha deciso di sanzionare 28 persone che hanno gravemente violato la sovranità della Cina e che sono stati i principali responsabili di tali mosse degli Stati Uniti su questioni legate alla Cina.,OBJ
"Essi includono Michael R. Pompeo, Peter K. Navarro, Robert C. O’Brien, David R. Stilwell, Matthew Pottinger, Alex M. Azar II, Keith J. Krach e Kelly D. K. Craft dell’amministrazione Trump, nonché John R. Bolton e Stephen K. Bannon.",OBJ
"A questi individui e ai loro familiari stretti è vietato l’ingresso nella Cina continentale, Hong Kong e Macao. ",OBJ
"Loro, le aziende e le istituzioni loro associate sono anche limitate dal fare affari con la Cina.",OBJ
"Laddove non arriva il governo, ci arriva Luca Zaia. ",SUBJ
"Il caso è quello delle mancate forniture dei vaccini Pfizer, con il taglio alle consegne previste che sta creando parecchi problemi nella campagna vaccinale. ",OBJ
"E il governatore del Veneto, nella consueta conferenza stampa quotidiana in cui fa il punto sull'emergenza coronavirus, ha rivelato di aver chiesto al colosso farmaceutico la vendita diretta delle dosi. OGG",OBJ
E ha aggiunto di aver anche contattato altri fornitori.,OBJ
"Spero in un riequilibrio di questa fornitura di vaccini, poi mi auguro si torni a regime ",SUBJ
ha premesso il Doge.,OBJ
Dunque non ha escluso che Pfizer possa avere un contratto di vendita diretta per i vaccini con gli operatori veneti:,OBJ
C'è un margine anche in questo senso.,SUBJ
"Una mossa alla Angela Merkel, quella di Zaia. ",SUBJ
"Proprio come la cancelliera tedesca, il governatore infatti cerca di andare oltre rispetto agli accordi della Commissione europea con Pfizer.  ",OBJ
Non ci è ancora dato sapere,OBJ
ha poi sottolineato,OBJ
se l'impegno Pfizer sia per quantitativi settimanali per contratto o per trimestre.,OBJ
Dunque il Veneto cerca anche strade alternative.,OBJ
Noi abbiamo cercato di comprare anche autonomamente i vaccini,OBJ
spiega,OBJ
ma non ci si riesce,OBJ
ha aggiunto.,OBJ
E ancora,OBJ
Siamo comunque disponibili ad avere contatti con Pfizer e con altre realtà che volessero avere incontri per diventare a loro volta anche un punto di rifermento nella produzione.,SUBJ
"Sembra anche che ci siano diponibilità di scorte a livello internazionale, ma è tutto da capire ",OBJ
ha concluso Luca Zaia.,OBJ
"Insomma, per ora non è stato possibile acquistare autonomamente il siero, ma la via sembra comunque percorribile. ",SUBJ
Potrebbe essere la settimana dei primi vaccini.,OBJ
"La prima iniezione avverrà, se non ci saranno intoppi, in Gran Bretagna nel fine settimana.",OBJ
"Anche Pfizer, intanto, dopo Moderna, ha chiesto l’approvazione dell'Unione Europea per il suo candidato vaccino. ",OBJ
"La richiesta sarà per un “uso condizionato"" in regime di emergenza, con l'impegno a proseguire i test per valutare sicurezza ed efficacia. ",OBJ
AstraZeneca e Oxford non hanno ancora presentato la loro richiesta di autorizzazione.,OBJ
"Dall'inizio dell'analisi, il 1° dicembre, l’Agenzia avrà bisogno di circa un mese per l’approvazione. ",OBJ
"In una nota, l'Ema ha fatto sapere  ",OBJ
"Se i dati saranno sufficienti, il processo di valutazione potrebbe terminare il 29 dicembre.",OBJ
Pfizer è pronta a far decollare verso tutti i paesi europei le sue dosi di vaccino immediatamente dopo aver ricevuto il timbro.,OBJ
"La Commissione Europea ne ha acquistati 200 milioni di dosi entro il 2021, con l'opzione di averne altri 100 milioni. ",OBJ
"All'Italia spetterà la quota del 13,65% (in base al numero di cittadini), quindi 27 milioni estendibili a 40. ",OBJ
"Il vaccino prevede anche un richiamo, quindi queste dosi basterebbero per 14-20 milioni di persone. ",OBJ
Moderna invece ha concluso con l'Unione Europea un contratto da 80 milioni di dosi estendibili a 160.,OBJ
All'Italia ne andrebbero quasi 22 milioni.,OBJ
"Londra batterebbe così sul filo di lana gli Stati Uniti, dove la riunione dell’autorità regolatoria (la Food and Drug Administration, Fda) è prevista per il 10 dicembre. ",OBJ
Da tempo la Casa Bianca annuncia per l’11 dicembre l’avvio della campagna di immunizzazione.,OBJ
Ma su queste dichiarazioni pesano due incognite.,OBJ
L’Fda ha fatto sapere che non accetterà di essere tirata per la giacca.,OBJ
Farà le sue valutazioni nei tempi che riterrà opportuni.,OBJ
E’ possibile dunque che decida di far slittare la data di approvazione.,OBJ
"Né, a Washington, ci si è ancora messi d’accordo sulla priorità da dare alle categorie da vaccinare.",OBJ
Operatori sanitari o persone anziane e fragili?,OBJ
Per stamattina è prevista una riunione degli esperti dei Centers for Disease Control.,OBJ
Dal risultato dipenderà in parte la logistica della distribuzione dei vaccini: trasportare le valigie a una temperatura più fredda dell’inverno antartico negli ospedali sarebbe relativamente più semplice che non portare le dosi direttamente al letto dei pazienti più fragili.,SUBJ
"Sono stati tutti condannati all'ergastolo i tre imputati per l'omicidio di Vasile Todirean, il senzatetto romeno bruciato l'8 luglio 2019 alla stazione di Villafranca di Verona e morto dopo due mesi e mezzo di agonia.",OBJ
"Liliano Bosoni, 64 anni, il romeno Cristian Tuca, 60 anni, entrambi senza fissa dimora, e il villafranchese Eros De Mori, 43 anni, sono stati riconosciuti colpevoli di omicidio pluriaggravato. ",OBJ
"La sentenza, emessa ieri sera a tarda sera dalla Corte d'Assise di Verona, presieduta da Sandro Sperandio, ha accolto in pieno le richieste del pubblico ministero Elvira Vitulli.",OBJ
"Le Messe di Natale si svolgeranno ""nella piena osservanza delle norme"". ",OBJ
"Lo ha detto monsignor Mario Meini, pro-presidente della Conferenza episcopale italiana (Cei), introducendo i lavori del Consiglio episcopale permanente.",OBJ
"Partendo dalla ""risonanza mediatica"" sulla questione degli orari delle Messe, ha sottolineato: ",OBJ
"""Se le liturgie e gli incontri comunitari sono soggetti a una cura particolare e alla prudenza, ciò non deve scoraggiarci: in questi mesi è apparso chiaro come sia possibile celebrare in condizioni di sicurezza, nella piena osservanza delle norme. ",OBJ
"Siamo certi che sarà così anche nella prossima solennità del Natale e continuerà ad essere un bel segno di solidarietà con tutti"". ",SUBJ
Parole di riconoscimento sono andate ai sanitari:,OBJ
"""I vescovi italiani esprimono vicinanza e ammirazione a tutti i medici e agli operatori sanitari, che stanno vivendo appieno la loro vocazione nella custodia del fratello malato e sofferente"".",OBJ
"""I dati diffusi negli ultimi giorni sul fronte della pandemia -",OBJ
spiega Meini,OBJ
"- rilevano sensibili miglioramenti, ma ci dicono che ancora non ne siamo fuori. ",OBJ
"Non devono venir meno pertanto la responsabilità e la prudenza, anzi dobbiamo rinnovare l'impegno verso ""il valore unico dell'amore"". ",SUBJ
"""Mentre alcuni interventi di ordine socio-economico stanno maturando nelle sedi istituzionali, i cristiani sono chiamati, insieme a tutti i cittadini, a fare la propria parte: sul piano sanitario rispettando tutte le norme precauzionali anti-contagio. ",OBJ
"Papa Francesco ci ricorda che siamo sulla stessa barca"" e che solo insieme potremo uscire bene da questa impervia fase della storia"".",OBJ
Su Natale il governo dice no alle Regioni.,OBJ
"Nessuna deroga, si tratta solo sui nonni",OBJ
Un anziano solo e lontano in famiglia ce l'hanno quasi tutti.,SUBJ
E allora l'ipotesi allo studio è quella di consentire a un familiare con il suo nucleo più stretto di potersi comunque spostare per trascorrere le festività con il genitore o il nonno solo.,OBJ
"Naturalmente con tutte le raccomandazioni del caso che verranno inserite nel Dpcm anche per chi, abitando nella stessa regione, potrà comunque passare i giorni di festa con i propri anziani.",OBJ
"L'orientamento del Cts è quello di dire sì, ma con queste regole: mascherina e distanziamento sempre e comunque anche se, come è consigliato, i commensali saranno freschi di tampone negativo che - ricordiamolo - non dà alcuna patente di negatività.",OBJ
"Quindi pochissimi a tavola (probabilmente non ci sarà nel Dpcm l'indicazione di un numero, ma la raccomandazione a limitarsi al nucleo convivente o più stretto), mascherina tolta giusto il tempo di mangiare e se possibile tavoli separati per anziani e bambini.",OBJ
"Se ne parlerà anche oggi nel confronto decisivo tra i ministri e i presidenti delle Regioni, che vanno ben oltre chiedendo più flessibilità negli spostamenti tra le Regioni di uguale colore, anche se per Natale quasi tutte dovrebbero essere in giallo. ",OBJ
"Unica eccezione la Sicilia che, appena passata in giallo nonostante il numero dei positivi sia ancora tra i più alti d'Italia e la situazione ospedaliera ancora molto difficile, è orientata a chiedere al governo di tagliare ancora i già ridotti all'osso collegamenti con l'isola e a chiedere tamponi a chi arriva, come se a portare il virus fosse chi arriva da regioni magari con situazioni epidemiologiche migliori.",SUBJ
Una posizione del tutto isolata nella conferenza delle Regioni.,OBJ
"Il Cts, dal canto suo, non disdegna neanche l'apertura dei ristoranti a pranzo nei giorni di festa, ritenendo che l'accesso controllato ai locali, con regole rigide e ben precise, nasconda meno insidie di pranzi familiari (con gli anziani naturalmente) sui quali nessuno potrà vigilare, visto che non sono consentiti controlli nelle abitazioni private e queste indicazioni non potranno che essere sotto forma di raccomandazione.",OBJ
Si ricomincia:,OBJ
"“È come le altre volte, non dormo. ",SUBJ
"Ansia, dolore, rabbia, si mescola tutto. ",SUBJ
"Anzi no, stavolta è peggio perché ci tengono fuori dall’aula"". ",OBJ
"E la distanza è tanta, da Viareggio a Roma. ",OBJ
"Siderale per uno come lui, Marco Piagentini che assieme agli altri familiari della strage di Viareggio (32morti, un centinaio di feriti, case e strade devastate dall’esplosione di un vagone del treno merci che trasportava gpl ed è deragliato il 29 giugno 2009) non saranno presenti domani all’udienza in Cassazione per via della pandemia, la Toscana è ancora una regione rossa e gli spostamenti sono vietati. ",SUBJ
E poi la Cassazione ha deciso che in aula anche gli stessi avvocati avranno accesso a rotazione.,OBJ
"Così i familiari delle vittime hanno scritto al premier Conte, al ministro della giustizia Bonafede, al presidente della Regione Toscana Giani:",OBJ
"“Vi chiediamo uno sforzo di comprensione"". ",OBJ
E più in là:,OBJ
"“Sappiamo bene quanto questo periodo sia difficile per tutti, ma non impediteci di poter essere presenti davanti alla Corte di Cassazione e di seguire via web quello che verrà discusso in quell’aula, non privateci della dignità di esserci"".",OBJ
"I giudici della quarta sezione penale dovranno esaminare - nel corso delle udienze fissate da mercoledì a sabato di questa settimana - i ricorsi presentati contro la sentenza emessa dalla Corte d'appello di Firenze il 20 giugno dello scorso anno, quando furono confermate le condanne, inflitte in primo grado dal tribunale di Lucca, tra gli altri, per gli ex vertici delle ferrovie: 7 anni per Mauro Moretti, ex amministratore delegato di Fs e Rfi, 6 anni per Michele Mario Elia (ex ad di Rfi) e Vincenzo Soprano (ex ad Trenitalia).",OBJ
"Il terzo grado di giudizio arriva a oltre 11 anni dalla notte d’estate in cui il treno merci Trecate-Gricignano, composto da 14 carri cisterna contenenti gpl, deragliò poco dopo aver superato la stazione di Viareggio e nella successiva esplosione di un carro, le fiamme divorarono le case di via Ponchielli lungo la ferrovia, dove adesso c’è un muro di sicurezza e prima niente. ",OBJ
Molte delle persone ustionate morirono dopo agonie di giorni e giorni.,OBJ
"Il processo, lunghissimo, era esposto al rischio prescrizione: infatti caddero prescritte le imputazioni di lesioni colpose gravi e gravissime e quelle di incendio, ma adesso il rischio è ancora superiore: ",SUBJ
"“Se la Cassazione rimandasse qualcuno degli imputati in appello e si rifacesse il processo, entro il 2021 cadrebbe prescritto anche il reato di disastro ferroviario"" ",OBJ
spiega l’avvocato di parte civile Tiziano Nicoletti.,OBJ
Resterebbe in piedi soltanto quello di omicidio colposo con l’aggravante dell’incidente sul lavoro.,OBJ
"Un pensiero insopportabile per chi porta ancora addosso i segni di quella strage: sessanta le operazioni subite da Marco Piagentini, il perito tecnico che nella strage perse la moglie Stefania e due dei tre figli più piccoli, Lorenzo e Luca di 2 e 4 anni e che rimase ustionato in maniera grave sul 98% del corpo. ",OBJ
"“Vogliamo giustizia, la chiediamo da 11 anni",SUBJ
dice Daniela Rombi che nella strage perse sua figlia Emanuela dopo un’agonia di 42 giorni al centro grandi ustionati di Pisa -.,OBJ
In primo e in secondo grado le responsabilità di ferrovie sono già emerse: gravi e chiare.,SUBJ
Ci aspettiamo che la Cassazione le confermi “.,SUBJ
Svolgevano tamponi per il Covid senza avere l'autorizzazione.,OBJ
"In caso di risultato positivo, non comunicavano alle Asl - o lo facevano in ritardo - il referto che prevede l'obbligo di isolamento. ",OBJ
"Effettuavano il prelievo in ambienti non abbastanza protetti, impiegando a volte tecnici non abilitati o reagenti scaduti.",OBJ
"Alcuni kit per i test sierologici, utilizzabili solo da professionisti, venivano venduti direttamente ai cittadini, perfino in erboristeria o profumeria. ",OBJ
Altri materiali da conservare in frigorifero erano tenuti a temperatura ambiente.,OBJ
"E i prezzi praticati, in alcuni casi, erano superiori rispetto ai tariffari concordati con le Regioni.",OBJ
"Maria Elena Boschi, ""un incubo"". ",SUBJ
"Travaglio, doppia pagina sul Fatto contro la renziana: ""Indagata al governo"", e giù insulti",SUBJ
"Torna ""l'incubo Boschi"".",SUBJ
Se ne esce così il Fatto Quotidiano il giorno dopo l'ennesima lite per le poltrone.,OBJ
"Il nome di Maria Elena Boschi, da sempre fedelissima di Matteo Renzi, è ormai in lizza per ogni ministero.",OBJ
"Dall'Economia, allo Sviluppo economico fino alle Infrastrutture e via discorrendo.",OBJ
È lei la deputata che il leader di Italia Viva vuole piazzare a tutti i costi.,OBJ
Anche a costo di far saltare nuovamente il banco.,OBJ
Nettamente contrario invece il Movimento 5 Stelle.,OBJ
"Vito Crimi vuole tenere in salvo Alfonso Bonafede che - a suo dire e a dire del quotidiano di Travaglio - ""resta alla Giustizia"".",OBJ
Queste le parole del reggente grillino che ripropone un vecchio veto:,OBJ
"""La Boschi non può far parte del prossimo governo"".",OBJ
"Pensare che è proprio la deputata ""indagata"" (così la descrive Il Fatto) a essere tra i candidati per la guida del ministero delle Infrastrutture.",OBJ
"Boschi - ricorda il quotidiano - infatti rischia di trovarsi in futuro nell'esecutivo da rinviata a giudizio"".",OBJ
"La renziana è indagata dalla Procura di Firenze, assieme a Matteo Renzi, Luca Lotti e pezzi del fu ""Giglio magico"" per finanziamento illecito alla (ormai) ex cassaforte politica del renzismo, la fondazione Open"". ",OBJ
"La pensa allo stesso modi di Travaglio anche Davide Crippa, presidente dei deputati del Movimento 5 Stelle:",OBJ
“Boschi ministra andrebbe contro quello che abbiamo fatto in passato.,SUBJ
Non non dico no come ministro.,SUBJ
"Dico che se si sceglie una condizione, deve essere una condizione trasversale. ",SUBJ
"Se si sceglie di mantenere quella condizione come abbiamo fatto in passato, la faremo mantenere e ci sarà una maggioranza che valuterà le condizioni"". ",OBJ
"Visti i litigi di queste ore per firmare un ""cronoprogramma"" che accontenti tutte, sembra che ne vedremo delle belle.",SUBJ
Con o senza Boschi al governo in un eventuale Conte ter.,OBJ
"Mezz'ora in più, Marco Travaglio scatena la bufera:",OBJ
"""Renzi come Bin Laden quando ha fatto saltare le torri""",OBJ
È polemica per l'uscita di Marco Travaglio a Mezz'ora in più.,OBJ
"Nel salotto di Lucia Annunziata il direttore del Fatto Quotidiano ha paragonato Matteo Renzi a Bin Laden, il noto terrorista saudita.",OBJ
"""Dire che"" Matteo Renzi ""è il più bravo di tutti perché ha fatto saltare il governo sarebbe come dire che Bin Laden è il più bravo di tutti perché ha fatto saltare le due torri"", ",OBJ
sono state le parole che hanno scatenato la bufera.,OBJ
Primi a puntare il dito contro Travaglio alcuni esponenti di Italia Viva.,OBJ
"""Oggi Travaglio su Rai Tre ha paragonato Matteo Renzi a Bin Laden.",OBJ
Giorni fa aveva invitato i lettori del suo 'giornale' a sputare su una foto del leader di Italia Viva.,OBJ
Io mi auguro che Renzi lo quereli.,SUBJ
"Perché questo signore, al servizio di Casalino, ha oltrepassato il segno"", ",OBJ
ha cinguettato Anna Rita Leonardi.,OBJ
Un post che lo stesso Renzi ha ricondiviso sui suoi social.,OBJ
"Dello stesso parere il deputato renziano, nonché segretario della commissione parlamentare per l'indirizzo generale e la vigilanza Rai, Michele Anzaldi. ",OBJ
"""Su Rai3 Travaglio, invitato in qualità di sostenitore di Conte, paragona Renzi al terrorista Bin Laden, con un rancore che non dovrebbe avere nulla a che fare col servizio pubblico.",OBJ
"Se non arrivano prese di distanza da Conte, per me andrebbe interrotta ogni trattativa di governo"". ",OBJ
"Oltre che per aver dato via alla crisi di governo, l'ex premier è balzato agli onori della cronaca per una conferenza in Arabia Saudita.",OBJ
"Una conferenza pagata, che subito lo ha visto accusato di essere ""testimonial"" del regime saudita.",OBJ
Non la vede così il diretto interessato che ha spiegato:,OBJ
"""Sono stato a fare una conferenza.",OBJ
"Ne faccio tante, ogni anno, in tutto il mondo, dalla Cina agli Stati Uniti, dal Medio Oriente alla Corea del Sud"" e “quanto all’Arabia Saudita, soltanto chi non conosce la politica estera ignora il fatto che stiamo parlando di uno dei nostri alleati più importanti.",OBJ
"Il regime saudita è un baluardo contro l’estremismo islamico, la forza politica ed economica più importante dell’area"". ",OBJ
Mario Monti mette in guardia Giuseppe Conte da Roberto Fico:,OBJ
"""Se non ha il controllo, non deve accettare""",OBJ
Mario Monti allontana l'ipotesi di un governo di unità nazionale.,OBJ
In questa crisi aperta da Matteo Renzi sono due i nomi sulla bocca di tutti: Mario Draghi e Marta Cartabia.,OBJ
"Eppure di un governo guidato da un presidente del Consiglio che non appartenga a nessuno schieramento politico e con vocazione a essere sostenuto da tutte le forze parlamentari, se non sbaglio c’è un solo precedente nei 75 anni della Repubblica"".",OBJ
è il ragionamento che fa l'ex premier al Corriere,OBJ
