Sentence,Label
"Italia viva, che aveva chiesto un documento con cronoprogramma, avrebbe poi detto sì alla scelta di redigere un verbale di fine riunione ma avrebbero lamentato, alla lettura del testo, che non rispecchia le diverse posizioni che si sono registrate al tavolo su alcuni temi.",OBJ
Pare così definitivamente tramontata l'ipotesi di un Conte-ter.,SUBJ
La palla ora torna a Sergio Mattarella.,OBJ
"Probabile che si tenti un governo istituzionale, che potrebbe anche prendere la forma del cosiddetto ""governo dei migliori"", il governo-Ursula che Silvio Berlusconi e Forza Italia, a più riprese, non hanno escluso negli ultimi giorni.",SUBJ
"Un indizio in tal senso anche la fuoriuscita di Emilio Carelli, che ha abbandonato il M5s alla Camera.",SUBJ
Altri grillini potrebbero presto lasciare il partito per riposizionarsi in gruppi parlamentari favorevoli a questo tipo di schieramento.,SUBJ
"Matteo Renzi ""ha deciso di rompere"", niente accordo: salta Giuseppe Conte?",OBJ
"Indiscrezioni sul ""verbale taroccato""",SUBJ
Nessuna intesa.,SUBJ
"Secondo quanto si apprende da fonti di maggioranza impegnate al tavolo del cronoprogramma, non c’è intesa sul verbale che dovrebbe chiudere il tavolo sul programma dopo due giorni di lavori. ",OBJ
"Nel dettaglio Italia viva, che aveva chiesto un documento con cronoprogramma, avrebbe poi detto sì alla scelta di redigere un verbale di fine riunione ma avrebbero lamentato, dopo aver letto il testo, che non rispecchiava le differenti posizioni emerse al tavolo nel corso di questi due giorni di fuoco.",OBJ
"Insomma, per i renziani si tratterebbe di una sorta di verbale ""taroccato"", risistemato ad-hoc, per fingere che ci sia un accordo.",SUBJ
"insomma, la farsa continua.",SUBJ
"Come possono, questi, trovare un accordo per un nuovo governo?",SUBJ
"Ma non è tutto, a strettissimo giro di posta si apprende che ""Matteo Renzi ha deciso di rompere"".",OBJ
"La conferma arriva da fonti di maggioranza che affermano che ""Italia Viva ha detto no a tutto"".",OBJ
"Scontro sul programma e sui ministri, con il rifiuto delle altre forze di maggioranza a concedere dei ministeri a Italia Viva, compreso il ritorno di Teresa Bellanova.",OBJ
"Insomma, Roberto Fico dovrebbe salire al Quirinale per comunicare il fallimento della trattativa.",SUBJ
"Fico, il cui mandato esplorativo è in scadenza oggi e che in serata riferirà a Sergio Mattarella pochi secondi prima delle 18 è entrato nella sala della Lupa dove i rappresentanti della possibile maggioranza hanno completato un verbale dei loro incontri.",OBJ
"Proprio il verbale ""incriminato"".",OBJ
"Insomma, l'accordo sembra non esserci e, come è noto, oggi uno dei nodi principali è stato quello relativo alla Giustizia, con le riforme in tal senso e, soprattutto, con l'avvicendamento di Alfonso Bonafede, che in primis Matteo Renzi non vuole più vedere sulla poltrona di Guardasigilli.",SUBJ
"Nel frattempo, contro il M5s è piovuto l'addio di Emilio Carelli, che lascia il gruppo alla Camera del partito, affermando che i grillini ""hanno perso la loro anima"". ",OBJ
"Carelli, ha poi aggiunto che ",OBJ
"""a quel che mi risulta, ora lo scontro è sui ministri"".",OBJ
"Insomma, al tavolo del cronoprogramma è lite sulle poltrone.",SUBJ
"Sempre più lontano, insomma, il ""ter"" di Giuseppe Conte a Palazzo Chigi. ",SUBJ
"Avanza l'ipotesi del cosiddetto ""governo dei migliori"". ",SUBJ
"Matteo Bassetti ""sotto scorta dinamica"": minacce di morte dopo Non è l'arena, la mossa della prefettura",OBJ
"Orrore contro Matteo Bassetti, il celebre virologo.",SUBJ
"Un orrore firmato no-vax che si è scatenato dopo la sua ospitata di domenica sera a Non è l'Arena, il programma di Massimo Giletti su La7.",SUBJ
"Durante la puntata, l'infettivologo del San Martino di Genova aveva sostenuto l'utilità del vaccino nella battaglia al coronavirus, uno strumento fondamentale e ineludibile per lasciarci alle spalle questa maledetta pandemia.",OBJ
E tanto è bastato per finire nel mirino di no-vax e pazzi assortiti.,SUBJ
"A rivelare quanto accaduto, è stato lo stesso Bassetti su Facebook.",OBJ
"Nelle ultime 48 ore ho ricevuto insulti di ogni tipo, minacce alla mia persona e persino minacce di morte",OBJ
premette l'infettivologo.,OBJ
"E ancora, aggiunge:",OBJ
Ogni singolo messaggio è stato inviato alla Polizia Postale e alla Digos per le indagini del caso.,OBJ
"I responsabili saranno perseguiti a norma di legge"".",OBJ
E purtroppo non è tutto.,SUBJ
"In seguito anche a questo episodio, la Prefettura ha disposto la ""vigilanza dinamica"" per Bassetti.",OBJ
"Si tratta di una sorta di scorta, non continuativa, ma che prevede una particolare attenzione ai luoghi più visitati dal medico, ormai un bersaglio della marmaglia no-vax che infesta social e dintorni.",OBJ
"In virtù della vigilanza dinamica, viene tenuto sotto osservazione in San Martino, dove lavora, con frequenti passaggi delle pattuglie di polizia e carabinieri nell'ambito delle attività di controllo del territorio.",OBJ
Anche l'abitazione di Bassetti viene ovviamente monitorata.,OBJ
"Purtroppo, non è la prima volte in cui l'esperto viene minacciato.",SUBJ
"Una ulteriore denuncia era arrivata tempo fa, sempre su Facebook, doveva aveva dato conto delle minacce ricevute per quanto sostenuto sui vaccini.",OBJ
"In quel caso, Bassetti presentò denuncia per diffamazione e minacce aggravate.",OBJ
"Coronavirus, bollettino 2 febbraio: 499 morti e ricoveri ordinari in aumento, i contagi sono 9.660",OBJ
"Continua a essere stabile la situazione epidemiologica dell’Italia, che non riesce a migliorare ulteriormente a causa della mancanza di ulteriori provvedimenti (ma d’altronde chi dovrebbe prenderli?",SUBJ
"È tutto fermo in nome della crisi di governo), ma che allo stesso tempo non peggiora.",OBJ
"E questa è già di per sé una bella notizia: il bollettino di martedì 2 febbraio rilasciato dal ministero della Salute dà conto di 9.660 contagiati, 18.976 guariti e 499 morti.",SUBJ
"Quest’ultimi sono tornati ad aumentare, confermando purtroppo un fenomeno che non si riesce a controllare: i decessi legati al Covid hanno raggiunto quota 89.334 nel nostro Paese, che presto arriverà a superare quota centomila. ",SUBJ
"Per quanto riguarda la situazione del servizio sanitario nazionale, il saldo dei ricoveri in reparti Covid è +57 (20.317 posti letto attualmente occupati), mentre quello in terapia intensiva è -38 (2.214) ma con 158 nuovi ingressi, segno che la mortalità incide ancora in maniera molto importante.",OBJ
"Nel frattempo prosegue la campagna di vaccinazione, che ha superato i 2 milioni di persone che hanno ricevuto la dose: di preciso sono 2.083.364 i vaccinati in totale.",OBJ
Inoltre oggi è arrivato anche il via libera da parte del Cts dell’Aifa alla somministrazione del vaccino AstraZeneca anche tra gli over 55 in buona salute.,OBJ
Migliora sensibilmente la situazione delle singole regioni: oggi nessuna ha fatto registrare la quadrupla cifra di contagio.,OBJ
"Quella con il più alto numero di nuovi casi è la Sicilia con 984, seguita dalla Campania (919) e dalla Lombardia (912).",OBJ
"Quest’ultima ha appena nominato Guido Bertolaso per la gestione della campagna di vaccinazione: il medico 70enne ha promesso che verrà portata avanti “24 ore al giorno per 7 giorni alla settimana"". ",OBJ
"Non solo, perché ha anche posto il traguardo di vaccinare “tutta la regione Lombardia prima della fine di giugno.",OBJ
"Se avremo vaccini, sarà assolutamente possibile e ce la faremo, ve lo garantisco"". ",OBJ
"Tragedia della Presolana, la lettera dell'amica:",OBJ
"""Valeria e Fabrizio erano parte della mia famiglia, aiutare la bambina è un gesto d'amore""",OBJ
"""Sono Marlene e vivo a Milano. ",OBJ
"Ho conosciuto Valeria e Fabrizio quasi 10 anni fa ed è stato un rapporto che è cresciuto giorno per giorno, fino al momento in cui le nostre famiglie si sono ampliate ed abbiamo avuto due bambine che sono cresciute insieme e si sono legate sempre di più"".",OBJ
"Comincia così la lettera con cui Marlene Martinelli si rivolge ai donatori della raccolta fondi avviata per sostenere la piccola di cinque anni che domenica ha perso i genitori davanti ai suoi occhi, in modo tragico: Valeria Coletta e Fabrizio Marchi, scivolati sul ghiaccio e morti in un burrone a Colle Vareno, sulla Presolana.",SUBJ
Una raccolta fondi che in meno di 24 ore ha superato i 2.200 donatori e ha raggiunto quota 93 mila euro.,OBJ
"""Seppur un contributo economico non possa lenire il dolore di una simile tragedia, poter contribuire ad alleviare qualsiasi preoccupazione economica è tutto ciò che tutti noi possiamo fare e desiderare per la famiglia travolta da questo dramma"",",OBJ
scrive Marlene.,OBJ
"""Fabrizio e Valeria sono stati due figure di riferimento nella mia vita e mi hanno aiutata in molti momenti difficili -",OBJ
scrive ancora Marlene -,OBJ
Hanno preso a cuore mia figlia come fossero degli zii e mi hanno protetta e sostenuta sempre.,SUBJ
"Sono diventati amici, confidenti, famiglia, e sarebbero stati a breve i miei testimoni.",SUBJ
Nel corso degli anni ho conosciuto ogni membro della loro famiglia e sono sicura che la bambina sarà circondata da amore nella sua crescita.,SUBJ
"Questa raccolta fondi nasce dalla più limpida delle motivazioni, la volontà di aiutarla nella sua crescita e dalla consapevolezza che la coppia avrebbe fatto lo stesso per proteggere mia figlia.",SUBJ
"I fondi saranno devoluti alla nonna paterna che da sempre, per vicinanza, ha assistito a tutte le dinamiche famigliari e ha contribuito costantemente alla crescita della bambina conoscendo alla perfezione tutte le sue esigenze.",OBJ
"Vorremmo che i fondi fossero utilizzati liberamente dalla famiglia per tutte le necessità ed il sostentamento della bambina e verranno trasferiti tramite bonifico direttamente al beneficiario"".",OBJ
"Codogno, restaurato il murale con la Wonder Woman anti-Covid:",OBJ
"""I vandali non hanno vinto""",OBJ
"Lo strappo al murales dell'infermiera ""Wonder Woman"" di Codogno ricucito da due amici per caso.",OBJ
"Il manifesto dell'eroina Comics realizzato dall'artista padovano Alessio B e danneggiato alcune settimane fa da ignoti, è stato riparato nel weekend.",OBJ
"Chi l'ha visto ha pensato subito a un ritorno dello street artist in città, a sorpresa, per riparare il danno, non potendo immaginare che a sistemarlo sono stati due concittadini, il pensionato Tino Bruschi, 67 anni, ex elettricista alla centrale elettrica di Montanaso Lombardo, e Pietro Belloni, di professione parchettista.",OBJ
"I vandali avevano deturpato l'opera applicata con la tecnica del ""paste up"" stracciando metà della figura, ma il lembo di carta era rimasto penzoloni e quando Belloni ha visto la foto postata da Tino sulla sua pagina Facebook alcuni giorni fa, gli è balenato subito in mente di metterla a posto.",SUBJ
"Così pur non conoscendolo di persona gli ha scritto, si sono trovati subito d'accordo, e decisi a fare le cose per bene.",OBJ
"Il pensionato ha contattato il proprietario della vecchia stazione di benzina in via Diaz a Codogno dove Alessio B ha scelto di lasciare la sua traccia, per avere il permesso a intervenire.",OBJ
"L'ex benzinaio, ""Tranquil"" come lo chiamavano e lo chiamano tutt'oggi, ha dato loro le chiavi del cancelletto per entrare nell'area recintata, e sabato alle 14,30 Bruschi e Belloni si sono dati appuntamento davanti a Wonder Woman, decisi a rammendarla.",OBJ
"Acquistata la colla per manifesti, come attacchini, i due ""soci"" hanno riattaccato la striscia strappata.",SUBJ
"Mancava però per completare l'opera un pezzo che era volato via lasciando sfigurato proprio il volto dell'eroina Comcis, ma la fortuna è stata dalla loro parte, lo hanno ritrovato per terra in mezzo a un ciuffo d'erba cresciuto sul cemento, e così hanno potuto completare l'opera.",OBJ
"""Sembriamo quelli che vanno a fare un atto eroico ma è veramente banale, poteva mettersi lì a farlo chiunque, come si dice, ""val più un fare che cento dire"" -",OBJ
commentano i due -.,OBJ
"Per Codogno ""Wonder Woman"" è diventata un simbolo della lotta al Covid-19 e dispiaceva a tutti vederla ridotta in quello stato.",SUBJ
"I vandali non l'hanno avuta vinta"".",OBJ
"Saronno: fuga in auto tra la folla, pusher arrestati grazie ai video dei passanti",OBJ
"Due spacciatori trentenni sono stati arrestati dai carabinieri con l'accusa di resistenza a pubblico ufficiale, dopo essere scappati in auto da Cesano Maderno (Monza) a Saronno (Varese) dove a bordo di un'Alfa Romeo hanno terrorizzato pedoni e residenti sfrecciando per il centro storico e in area pedonale a grande velocità.",OBJ
"Ad aiutare, sabato sera, i carabinieri a identificarli con certezza e ricostruire la dinamica dell'accaduto sono stati gli stessi presenti, tramite video girati con il cellulare e poi resi disponibili per le indagini. ",OBJ
"Al termine di una fuga per un ""alt"" ignorato, iniziata in Brianza e terminata nel Varesotto, il conducente della macchina ha perso il controllo ed è finito contro una rastrelliera.",OBJ
"A quel punto, assieme ad altri due uomini a bordo, è fuggito a piedi.",OBJ
"Due di loro, marocchini regolarmente residenti in Italia, sono stati bloccati, tra gli applausi dei presenti.",OBJ
"Il Tribunale di Busto Arsizio (Varese), anche grazie alla collaborazione dei cittadini, ha disposto per loro la misura cautelare dei domiciliari.",OBJ
È ancora in corso l'identificazione del terzo occupante dell'auto.,OBJ
"La lunga attesa di Billy, il cane che aspetta a casa il padrone malato di Covid",OBJ
"""Gli occhi tristi di Billy mi danno un fortissimo stimolo per guarire.",OBJ
"Voglio tornare al più presto da lui"":",OBJ
"Marco Maiolani, 55enne volontario della Protezione civile di Dorno (nel Pavese), è ricoverato a causa del Covid-19 dallo scorso novembre e non vede l'ora di riabbracciare il suo cane, che ogni giorno, da due mesi, si mette davanti alla porta di casa e lo aspetta.",OBJ
"Billy è un meticcio di due anni, simil border collie, e quando lui e Marco si sono incontrati ",OBJ
"""è stato amore a prima vista. Era appena nato. Sua madre è di proprietà di una mia cara amica e quando sono stato a vedere la cucciolata lui mi è subito saltato in braccio -",OBJ
racconta Maiolani -,OBJ
"Non eravamo mai stati separati tanto a lungo e i miei nipoti mi dicono che piange, mi cerca ovunque, ulula persino.",SUBJ
"Io non gliel'avevo mai sentito fare"".",OBJ
"Ogni giorno, da quando il suo amico umano è stato costretto ad allontanarsi da casa - prima per essere ricoverato al San Matteo di Pavia e ora all'Istituto Maugeri per la riabilitazione - Billy si è messo in giardino ad attenderne pazientemente il ritorno.",OBJ
"""Mi hanno detto che porta fuori le sue coperte e i cuscini e aspetta. ",OBJ
Solo alla sera i miei nipoti riescono a convincerlo a rientrare in casa -,OBJ
continua Maiolani - .,OBJ
Lì dorme accoccolato su una mia maglietta.,OBJ
"Evidentemente avverte il mio odore e si tranquillizza"".",OBJ
L'uomo ha deciso di rendere pubblica la sua storia con un post su Facebook perché,OBJ
"""spero serva da lezione a tutti quelli che disprezzano e maltrattano gli animali.",OBJ
Io ne ho avuti di tutti i tipi e posso dire a ragion veduta che noi umani non abbiamo che da imparare da loro -,SUBJ
conclude -,OBJ
Non agiscono per il loro tornaconto.,SUBJ
Tutto ciò che fanno nasce da un amore sincero e disinteressato.,SUBJ
"Il mio rapporto con Billy ne è una prova"".",OBJ
"Covid, 200 ragazzi accalcati dentro un locale di Bolzano senza mascherina. ",OBJ
Multati in 155,OBJ
"I carabinieri della compagnia di Ortisei hanno impiegato ore solo per identificarli tutti: in barba alle norme anti-Covid, accalcati dentro un locale a Selva di Val Gardena, nella provincia autonoma di Bolzano, si trovavano circa 200 clienti.",OBJ
"Un numero che, anche in tempi normali, sarebbe stato un problema, dal momento che il locale può contenere soltanto 80 persone.",OBJ
"Ma che in questo caso, come riporta La Stampa, ha portato i militari a multare circa 155 ragazzi, poco più che ventenni, per aver trasgredito le norme anti-Covid.",OBJ
"Inoltre, altri due ragazzi sono stati denunciati per essersi rifiutati di fornire le proprie generalità, tre sono stati sanzionati per ubriachezza in pubblico e, infine, uno per aver opposto resistenza durante i controlli.",OBJ
"Nei guai anche il titolare del locale, la cui condotta è attualmente al vaglio delle Autorità amministrative e che è già stato multato per il mancato rispetto delle norme anti contagio.",OBJ
"I giovani, oltre a non aver rispettato alcun distanziamento sociale né aver indossato le mascherine, per sfuggire al controllo dei carabinieri si sono lasciati dietro anche dosi di sostanze stupefacenti: undici grammi di marijuana, abbandonati all’interno del locale.",OBJ
"Ciaspolata “bloccata"" nelle Marche: il governo lo consente, ma i partecipanti non mostrano l’autocertificazione ai vigili temendo la multa",OBJ
"Il gruppo, quindi, credendo di rischiare una multa da 400 euro, non ha firmato alcuna autocertificazione e ha fatto dietro-front.",OBJ
"“Un ingiusto e brutto episodio che annulla tutte le belle parole spese sull’importanza del turismo di prossimità e della sicurezza dello sport all’aria aperta che in questo periodo dovrebbe sostenere il morale di una nazione piegata dall’epidemia e promuovere la tutela della salute e il benessere psicofisico delle persone"",",OBJ
ha spiegato al Resto del Carlino Dormicchi.,OBJ
“Io sono convinto di essere nel giusto –,SUBJ
ha ribadito la guida –,OBJ
"ma se ognuno interpreta la norma a modo suo è la fine"".",OBJ
"Diversa la versione fornita dal comandante della polizia locale, Davide Felice, in merito all’episodio:",OBJ
“Le colleghe presenti sul posto in servizio anti assembramento hanno chiesto l’autocertificazione per chi era uscito dal proprio Comune.,OBJ
Ma nessuno voleva fornirla.,OBJ
Noi eravamo lì per constatare la veridicità tra quanto dichiarato e la pratica.,OBJ
"Non avendo voluto dichiarare nulla, sono andati via.",OBJ
"Se avessero dichiarato e poi fatto veramente la ciaspolata non avrebbero avuto nulla da temere"".",OBJ
"Maltempo nel Salernitano, esonda il fiume Sarno: 30 famiglie evacuate. ",OBJ
Le immagini aeree.,OBJ
"Sono proseguiti per tutta la giornata di ieri gli interventi dei Vigili del fuoco per allagamenti provocati dall’esondazione del fiume Sarno tra i Comuni di Angri e San Marzano sul Sarno, nel Salernitano.",OBJ
I Vigili del Fuoco hanno messo in salvo diverse persone in difficoltà.,OBJ
"“In questo momento con i tecnici comunale, la Protezione civile che mi ha inviato la Regione e la Polizia locale stiamo verificando casa per casa la situazione"",",OBJ
"ha detto all’ANSA la sindaca di San Marzano sul Sarno, Carmela Zuottolo.",OBJ
"“Dobbiamo capire se qualcuno ha bisogno di essere accolto nelle strutture comunali perché l’allerta meteo è stata prorogata"".",OBJ
"Il sindaco di Angri, Cosimo Ferraioli, afferma che ",OBJ
"“ci sono tutte le condizioni per dichiarare lo stato di calamità naturale ed è una strada da intraprendere ora prima che sia troppo tardi"".",OBJ
Il vicepresidente della Giunta regionale Fulvio Bonavitacola ha indetto una riunione per stamattina con gli enti locali delle zone interessate dall’esondazione del fiume Sarno.,OBJ
Saluti romani al funerale del padre del sindaco di Pietrasanta.,OBJ
"E l’uomo di Fratelli d’Italia che corse alle Regionali fa il rito del “presente""",OBJ
"Saluti romani e la chiamata del “presente"".",OBJ
"Si è concluso così il funerale di Adriano Giovannetti, padre di Alberto, sindaco di Pietrasanta, in provincia di Lucca.",OBJ
"Al momento dell’uscita del feretro dal Duomo una decina di persone avrebbe fatto il saluto romano e Massimiliano Simoni, candidato alle ultime Regionali con Fratelli d’Italia, ha gridato:",OBJ
"“Camerata Adriano presente"".",OBJ
Lo riportano i quotidiani Tirreno e Nazione nell’edizione di Viareggio-Versilia.,OBJ
"Giovannetti, 84 anni, era il titolare dell’agraria Seardo e padre di Alberto, eletto due anni e mezzo fa primo cittadino del paese della Versilia.",OBJ
"Simoni, come riporta la stampa locale, ha spiegato che questa mia chiamata, così si definisce, non ha alcun significato nostalgico o fascista, ma semplicemente si rifà al contesto militare"".",OBJ
Quindi ha aggiunto:,OBJ
"“Quando muore un militare, infatti, viene appunto salutato con la chiamata del presente per testimoniare che continuerà a vivere nella memoria di ognuno di noi"".",OBJ
"Il ricordo di Adriano Giovannetti, ha concluso ",OBJ
"“per quello che ha rappresentato, per la sua coerenza, per i suoi ideali resterà sempre presente in tanti di noi"".",OBJ
"OSS precari, la lettera dei Sindaci della Provincia di Brindisi",OBJ
“Mancano poche ore alla scadenza dei contratti riguardanti il personale Oss assunto a tempo determinato e utilizzato nelle strutture sanitarie di pertinenza dell’Asl di Brindisi.,OBJ
"Si tratta di uomini e donne coraggiosi che hanno garantito, con le loro prestazioni, la tenuta del sistema sanitario pubblico durante la fase più difficile dell’emergenza sanitaria da Covid 19.",SUBJ
"Privarsi della loro presenza in questo momento significherebbe sguarnire interi reparti, visto che si tratta di lavoratori non immediatamente sostituibili.",OBJ
Il che potrebbe determinare pericolose lacune nel servizio di assistenza fornito prevalentemente alle centinaia di cittadini della provincia di Brindisi che hanno fatto (e continuano a fare) ricorso agli ospedali per le conseguenze della pandemia.,SUBJ
"I sindaci della provincia di Brindisi, pertanto, le chiedono di procedere con una proroga dei contratti riguardanti gli Oss per non determinare un brusco decremento dei livelli di assistenza offerti dalle strutture ospedaliere della provincia di Brindisi"".",OBJ
"Corruzione atti giudiziari Brindisi, Macina (M5S):",OBJ
“Quadro inquietante.,SUBJ
"Liberare la giustizia da mele marce"" ",OBJ
"“L’inchiesta della Procura di Potenza, che vede coinvolti giudici e professionisti che operano presso il Tribunale di Brindisi, con la pesante accusa di associazione a delinquere finalizzata alla corruzione in atti giudiziari, ritrae un quadro inquietante e sconcertante"".",OBJ
"Così la deputata Anna Macina (M5S), a proposito dell’inchiesta su alcune procedure fallimentari che ha portato questa mattina a diversi arresti, fra cui anche un magistrato della Sezione Fallimentare di Brindisi. ",OBJ
“Al netto –,OBJ
continua –,OBJ
"della necessità di attendere gli esiti degli accertamenti giudiziari in corso e che stabiliranno eventuali responsabilità penali, l’impianto accusatorio che emerge dalle cronache giornalistiche è molto grave e ritrarrebbe un sistema deteriorato in cui l’esercizio della giustizia potrebbe apparire inquinato, sovvertito e sfruttato per fini opposti rispetto a quella che dovrebbe essere la missione principale dell’istituzione.",SUBJ
Questo infanga anche quella stragrande maggioranza di magistrati che svolgono il proprio dovere con disciplina e onore.,SUBJ
"Auspico tempi rapidissimi per gli esiti di quest’inchiesta, perché i valori democratici passano anche e, soprattutto, attraverso la terzietà e l’osservanza rigorosa delle norme da parte di coloro che ricoprono ruoli nella magistratura, cui spetta di salvaguardarli e tutelarli, cosí da non intaccare la fiducia che i cittadini nutrono nelle istituzioni e nella magistratura""",OBJ
conclude la deputata.,OBJ
Crollo solaio a San Michele: quattro persone indagate,OBJ
"Quattro persone sono indagate per il crollo del solaio di un capannone, incidente sul lavoro avvenuto ieri a San Michele Salentino (Brindisi), durante la posa in opera di calcestruzzo, a causa del quale un uomo di 49 anni, Franco Mastrovito, è morto e altri quattro operai sono rimasti feriti.",OBJ
"Gli indagati sono tecnici e responsabili delle ditte esecutrici dei lavori di ampliamento di una concessionaria: Stefano Barletta, di San Michele Salentino;",OBJ
Giuseppe Mazzotta di Novoli;,OBJ
Andrea Turrisi di Ostuni;,OBJ
Domenico Padula di San Pietro Vernotico.,OBJ
"Rispondono di omicidio colposo, accusa ipotizzata nell’atto con cui il pm Gualberto Buccarelli ha disposto il conferimento di incarico per l’autopsia sulla vittima, titolare di una impresa che si stava occupando dei lavori.",OBJ
L’esame è stato fissato il 29 gennaio prossimo.,OBJ
"I feriti sono tutti ricoverati all’ospedale Perrino di Brindisi: uno è in prognosi riservata, gli altri tre si trovano in Ortopedia, con prognosi di 30 giorni.",OBJ
"E’ venuto a mancare Mario Brugnerotto, grande calciatore di successo",OBJ
"E’ venuto a mancare Mario Brugnerotto,  calciatore di successo .",OBJ
"Nato a Martellago in provincia di Venezia nel 1938, arrivò a Brindisi nell’estate del 1959 con la squadra in serie D, allenata da Michelini.",OBJ
"Rimase a Brindisi fino al campionato 1971/1972 (l’ultimo anno in serie C, quello della promozione in serie B).",OBJ
"Ha legato la sua esperienza di allenatore al San Vito con il campionato di Prima Categoria nell’anno 1980/81, che i biancoverdi vinsero imbattuti (unica volta nella storia calcistica locale).",OBJ
"Nel 2011 in occasione del trentennale, di quel vittorioso torneo, Brugnerotto circondato da tantissimi tifosi e dai suoi calciatori del tempo, venne festeggiato dal sodalizio sanvitese,.",OBJ
"Ci piace riprodurre le pagine de “il biancoverde"" a ricordo di quella meravigliosa giornata.",SUBJ
La polizia locale ha una nuova comandante: è Anna Lucia Matarrelli,OBJ
"Il Corpo della Polizia Locale di San Michele Salentino ha una nuova comandate: è Anna Lucia Matarrelli,  39 anni, originaria di Latiano.",OBJ
Ha conseguito la  laurea in Giurisprudenza presso l’Università degli studi di Lecce e un Master di alta specializzazione in Diritto Penale dell’Impresa presso l’Università degli studi di Bari.,OBJ
