Sentence,Label
"Un governo di larghe intese, che ricalchi in qualche misura l’alleanza che regge la Commissione Europea, è la soluzione forte che sarebbe in linea con la drammaticità della situazione, e avrebbe una sua ragionevolezza ulteriore nel fatto che è proprio nel rapporto con l’Unione che il prossimo esecutivo si giocherà gran parte delle sue chance di riuscita.",SUBJ
"Ma proprio perché si tratta di una prospettiva seria, occorrerebbe maggiore prudenza prima di tirare in ballo l’ex presidente della Bce e il Quirinale.",SUBJ
"A ben vedere, sul taccuino di Mattarella quella di un governo 'istituzionale', o di larghe intese, è una soluzione alla quale si è resa disponibile, e nemmeno come opzione principale, la sola Italia Viva.",OBJ
"Non l’hanno presa in considerazione le forze della ex maggioranza, né l’ha considerata la pletorica delegazione del centrodestra, di fatto consegnata, almeno in questa fase, al mantra del voto anticipato.",SUBJ
"A che vale allora accreditarla in via ufficiosa, dopo non aver dato disponibilità nelle consultazioni con il capo dello Stato?",OBJ
"Nelle ricostruzioni lo 'spettro' di Draghi, paradossalmente, viene usato da entrambi i contendenti per fini opposti.",OBJ
"A Palazzo Chigi il suo nome verrebbe evocato (al netto delle smentite) come 'pericolo' da scongiurare, per ricompattare il M5s sul Conte ter.",OBJ
"Viceversa, per Renzi sarebbe funzionale a tranquillizzare i suoi, escludendo che Conte sia davvero l’ultima carta.",OBJ
E così la soluzione più 'alta' rischia di naufragare nel vortice dei tatticismi.,SUBJ
"Pillola Ru486, anche il Lazio ora strappa.",OBJ
"Aborto farmacologico anche negli ambulatori, nei consultori e non solo in ospedale.",OBJ
Il Lazio strappa e recepisce le linee guida del ministero della Salute per garantire la Ru486 anche fuori dal ricovero ospedaliero.,OBJ
La decisione regionale propone di,OBJ
"«rimuovere gli ostacoli all’accesso alla metodica farmacologica, nell’ottica di assicurare a tutte le donne che richiedono l’interruzione volontaria di gravidanza un servizio che tenga conto dei dati basati sulle evidenze scientifiche e rispettoso dei loro diritti».",OBJ
Viene dunque garantita alle donne la possibilità «tra regime di ricovero e regime ambulatoriale».,OBJ
Il documento approvato dalla Regione guidata da Luca Zingaretti precisa che,OBJ
"«il metodo farmacologico è sicuro ed efficace e può essere utilizzato, oltre che per l’interruzione volontaria, anche nel trattamento di varie condizioni cliniche quali l’aborto spontaneo, l’aborto incompleto, la morte fetale intrauterina».",OBJ
Dunque apre alla possibilità di usare la Ru486 anche per altre condizioni ostetriche.,OBJ
"«L’aborto diviene sempre più un fatto privato riguardante esclusivamente la donna, che può scegliere di assumere un farmaco e 'rinchiudersi' nella propria casa, lontana da una struttura sanitaria, mentre è in corso il processo di soppressione ed espulsione della vita umana che si stava sviluppando nel suo grembo: i rischi per la donna con l’aborto 'a domicilio' non possono essere sottaciuti»",SUBJ
"afferma Alberto Gambino, presidente dell’associazione Scienza & Vita.",OBJ
"«Il ricorso alla pillola può sembrare, infatti, solo apparentemente uno strumento più semplice e umanitario.",SUBJ
"La donna è lasciata sola e si finisce per banalizzare l’evento, drammatico, dell’interruzione della gravidanza».",SUBJ
aggiunge Gambino .,OBJ
"Nei mesi scorsi su alcuni territori, in realtà, si era aperta una breccia per impedire l’aborto farmacologico in regime di day hospital (Umbria) e per consentire l’uso della pillola solo in ospedale (Piemonte).",OBJ
"Ora il Lazio segue l’esempio di altre Regioni, come la Toscana, che va invece nella direzione opposta.",OBJ
"Zingaretti, Pd unito sul sostegno a Draghi con le nostre idee",OBJ
"""E' una fase nuova, Salvini sulla Ue dà ragione a noi""",OBJ
"""Nel Pd c'è unità assoluta su un punto che condivido anche io: con Draghi con le nostre idee, con i nostri valori.",OBJ
Perché la storia sta dimostrando che le nostre idee hanno fondamento.,SUBJ
"Draghi ha garantito un'idea di Europa"". ",OBJ
"Lo dice Nicola Zingaretti, segretario del Pd, a Mezz'ora in più su Rai3.",OBJ
"""Non c'è dubbio che è una novità: Salvini ha dato ragione al Pd, non ci siamo scostati noi.",OBJ
Tutti possono riconoscere che l'idea di risolvere i problemi distruggendo l'Europa era fallimentare.,SUBJ
"Si apre una fase nuova, non c'è dubbio: vedremo le coerenze"",",OBJ
dice ancora Zingaretti.,OBJ
"""Ho visto scricchiolare il progetto politico per cui il nuovo era un attacco alle democrazie occidentali e la morte dell'Europa"",",OBJ
aggiunge.,OBJ
Il Pd farà il congresso?,OBJ
"""Il Pd deve avere il coraggio per il futuro di rilanciare la propria prospettiva politica.",OBJ
risponde Zingaretti,OBJ
Spero solo che nessuno voglia rimettere indietro le lancette dell'orologio.,SUBJ
"La discussione congressuale che faremo, quando la faremo, sarà una vittoria di tutto il Pd unito.",SUBJ
Il congresso è previsto tra due anni ma appena finirà questa vicenda della formazione del governo porrò al partito l'interrogativo se e come andare avanti.,SUBJ
"Lo posso fare perché il Pd si è unito molto più di quanto non lo sia mai stato in 12 anni"".",OBJ
"Donna uccisa in casa a Palermo, il marito confessa",OBJ
La coppia ha tre figli,OBJ
"E' stata uccisa a coltellate Piera Napoli, 32 anni, cantante neomelodica e madre di tre figli piccoli, trovata morta nel bagno della sua abitazione in via Vanvitelli, a Palermo, oggi verso le 13.",OBJ
"Il marito Salvatore Baglione, 37 anni, si è presentato nella caserma dei carabinieri all'Uditore raccontando che la moglie era morta e dal quel momento è rimasto lì.",OBJ
Interrogato del pm Federica Paiola e del capitano Simone Calabrò ha confessato ed è stato fermato per omicidio aggravato.,OBJ
"Stamattina, secondo la ricostruzione degli investigatori, Baglione era uscito portando i tre bambini dai nonni ed era tornato a casa.",OBJ
Lì è divampata la lite.,OBJ
L'uomo ha preso un coltello da cucina colpendo più volte la moglie.,OBJ
Poi è sceso per recarsi dai carabinieri.,OBJ
"L'ennesimo femminicidio era stato annunciato da liti e violenze, che a volte avevano richiesto l'intervento della polizia, e da messaggi postati su Facebook.",OBJ
"Il padre di Piera Napoli, che dopo aver appreso la notizia, si è precipitato in via Vanvitelli, ha detto:",OBJ
"""Mia figlia restava ancora in quella casa per i bambini"".",OBJ
"Un rapporto incrinato da tempo, dunque.",OBJ
"Prima del delitto Baglione aveva pubblicato un post del profilo ""Dna criminale"": sullo sfondo di una foto di Robert De Niro, c'è scritto",OBJ
"""Il rispetto gran bella cosa, peccato che non tutti ne conoscano il significato"".",OBJ
La vittima sul proprio profilo Fb 15 ore fa aveva messo il post:,OBJ
"""Vuoi che ti regalino dei fiori il 14 (San Valentino) muori il 13"".",OBJ
Piera Napoli era molto conosciuta nel quartiere Cruillas.,OBJ
I vicini e i residenti del quartiere non sono molto loquaci.,OBJ
Qualcuno racconta che la coppia litigava e altri affermano che sentivano le urla di marito e moglie.,OBJ
Poi però tornava la pace.,OBJ
Soltanto apparente.,SUBJ
Blitz antisuprematista: arrestato a Savona un aspirante Breivik,OBJ
Si ispirava al sodalizio suprematista statunitense AtomWaffen Division e alle Waffen-Ss naziste il giovane di 22 anni di Savona destinatario di un’ordinanza di custodia cautelare in carcere emessa dal gip di Genova eseguito dalla Polizia.,OBJ
L’indagato è accusato di associazione con finalità di terrorismo e propaganda e istigazione a delinquere per motivi di discriminazione razziale aggravata dal negazionismo.,OBJ
"Fra gli obiettivi dichiarati figurava anche il compimento di azioni terroristiche di matrice suprematista analoghe a quelle realizzate nel 2011 e nel 2019 rispettivamente a Utoya (Norvegia) e Christchurch (Nuova Zelanda), la cui esaltazione frequentemente ricorre nelle conversazioni tra i membri del gruppo.",OBJ
"Notevoli anche ai riferimenti a Luca Traini, il fascioleghista marchigiano condannato a 12 anni per strage per il raid anti-immigrati del febbraio 2018.",OBJ
"In varie conversazioni il 22enne arrestato dalla polizia si è definito appartenente alla corrente ’Incel’, manifestando profondo astio nei confronti del genere femminile.",OBJ
"E’ quanto emerso dalle indagini condotte dalle Digos di Genova e Savona e dall'Ucigos, e diretta dalla Procura di Genova.",OBJ
"Le indagini sono scattate da un’inchiesta avviata da un altro ufficio giudiziario nei confronti di un minore confluito in gruppi suprematisti, legato all’arrestato da un forte vincolo di amicizia.",OBJ
"Sempre in base ai risultati delle indagini è emerso che in varie chat analizzate erano presenti istigazioni alla commissione di atti di violenza estremi anche sacrificando la propria vita, incoraggiando lo ’school shooting’ (i raid omicidi nelle scuole) o il ’day of the rope’ (la caccia ai ""traditori della razza"" evocata nei Diari di Turner, libro di culto e manuale operativo per i gruppi armati suprematisti bianchi.",OBJ
"Contemporaneamente all’arresto, gli uomini dell’antiterrorismo   hanno eseguito, con il concorso della Polizia Postale e delle Comunicazioni, 12 perquisizioni nei confronti di altrettanti contatti qualificati dell’indagato che hanno interessato, oltre a Savona e Genova, le città di Torino, Cagliari, Forlì-Cesena, Palermo, Perugia, Bologna e Cuneo.",OBJ
"I provvedimenti sono stati delegati dal sostituto procuratore Paolucci, titolare dell’indagine.",OBJ
Attacco nazi-hacker alla presentazione di un libro della Tagliacozzo,OBJ
"La Procura di Torino indaga su quanto accaduto domenica scorsa durante la presentazione on line del libro della giornalista Lia Tagliacozzo, ’La generazione del Deserto’ organizzata dall’Istituto di storia della Resistenza e dal centro studi ebraici di Torino.",OBJ
Un raid sul canale della piattaforma zoom in cui sono stato insultati gli organizzatori con frasi razziste e antisemite:,OBJ
"""Ebrei nei forni vi bruceremo tutti""",OBJ
"""Sono tornati i nazisti"",",OBJ
accompagnate dalla visione delle immagini di svastiche e di Hitler.,OBJ
"L’episodio è stato denunciato sui social dalla figlia della scrittrice, Sara De Benedictis.",OBJ
"Lia Tagliacozzo, che vive a Roma, è un’esperta di cultura ebraica e ha scritto libri per adulti e bambini.",OBJ
Ha girato l’Italia raccontando le storie descritte nelle sue opere.,OBJ
"""Quello che è accaduto domenica pomeriggio non è solo un campanello di allarme",OBJ
"afferma il consigliere regionale piemontese di Liberi e Uguali, Marco Grimaldi",OBJ
"il raid antisemita, avvenuto all’interno di una presentazione il cui accesso era vincolato a una richiesta da far pervenire via email, è un chiaro segnale che movimenti fascisti e neonazisti si stanno organizzando"".",OBJ
L’episodio non è l’unico.,OBJ
"Nei mesi scorsi, sempre con le stesse modalità , sono stati denunciati altri tre casi a Torino, sempre a presentazioni di iniziative culturali.",OBJ
"K2, Tamara Lunger rientra in Italia",OBJ
Una spedizione partita con tanto entusiasmo si conclude in maniera drammatica.,SUBJ
"È in viaggio verso l'Italia, Tamara Lunger, l'alpinista altoatesina di 34 anni, che stava tentando di salire il K2 (8611 metri) in inverno (sarebbe stata la prima femminile assoluta nella stagione più fredda), ma ha dovuto rinunciare dopo le tragedie che, negli ultimi giorni, hanno coinvolto la piccola comunità internazionale degli alpinisti sistemati al campo base.",OBJ
"Dopo il grande exploit del 16 gennaio, con dieci alpinisti sherpa nepalesi che, primi al mondo in inverno, sono stati capaci di raggiungere la vetta della seconda montagna più alta della Terra, una serie di tragedie ha funestato le restanti spedizioni.",OBJ
"Lo stesso giorno della vittoria nepalese, sulla montagna è morto il basco Sergi Mingote.",OBJ
"Per cercare di salvarlo, dal campo base è partita una squadra di soccorso, di cui faceva parte la stessa Lunger.",OBJ
È toccato proprio a lei trovarlo ormai privo di vita.,OBJ
"Venerdì scorso, ha poi perso la vita il bulgaro Atanas Skatov, precipitato dopo una manovra errata nei pressi di campo 3.",OBJ
"Da quel giorno si sono perse le tracce di altri tre alpinisti: l'islandese John Snorri, il cileno Juan Pablo Mohr e il pachistano Alì Sadpara, il più forte alpinista del suo paese (è stato il primo con Simone Moro a salire il Nanga Parbat d'inverno).",OBJ
"Per cercali, elicotteri dell'esercito pachistano hanno sorvolato la montagna, senza esito e ormai le speranze di trovarli ancora in vita sono ridotte al lumicino.",OBJ
"Proprio oggi, tra l'altro, è il 34esimo compleanno di Mohr, nuovo compagno di cordata di Tamara Lunger, dopo che il rumeno Alex Galvan aveva deciso di lasciare la spedizione a seguito della scomparsa di Mingote, che fino al giorno della morte si era legato alla corda proprio di Mohr.",OBJ
«Esperienza brutale»,SUBJ
"Al cileno, Tamara Lunger ha dedicato un toccante post su Facebook.",SUBJ
«Questa spedizione per me è stata la più brutale che ho vissuto.,SUBJ
Un’esperienza che ho cominciato come un sogno ed é finito in un incubo che mi rincorrerà per tanto tempo!»,SUBJ
"ha scritto l'alpinista italiana, ora impegnata nel trekking per Skardu, prima tappa del rientro in l'Italia, che avverrà nei prossimi giorni.",OBJ
«Guardare avanti adesso sarà la cosa da fare!,SUBJ
Sarà difficile ma farò del mio meglio.,SUBJ
prosegue Lunger,OBJ
Partirò da qui: proverò a girare le spalle al K2 per cercare un po’ di pace!,SUBJ
"JP, Alì, John, Sergi e Atanas vi porterò nel mio cuore per sempre».",SUBJ
La sanità è donna ma il gender gap è ancora ampio,SUBJ
Un'analisi del gruppo Lendostore su 30 paesi europei ha analizzato le condizioni delle lavoratrici.,OBJ
"In Francia il trattamento migliore, ma la Svizzera è quella che offre stipendi più alti.",OBJ
"In Italia il 70% dei lavoratori della sanità è donna, ma proprio in questo settore il gender gap si fa sentire ancora molto in termini di retribuzione ma anche di carriera.",SUBJ
"Lenstore, azienda leader nel settore delle lenti a contatto dal 2008, ha analizzato le politiche di 30 paesi europei.",OBJ
"Prendendo in considerazione il salario, le ore di lavoro e i giorni di ferie e le pari opportunità.",OBJ
Durante gli ultimi 12 mesi i diversi sistemi sanitari sono stati messi sotto stress a causa dello scoppio della pandemia.,OBJ
Il lavoro incredibile di medici e infermieri è stato più che mai indispensabile.,SUBJ
Secondo lo studio di Lenstore il paese che offre un migliore trattamento è la Francia.,OBJ
Qui c'è il numero più alto di donne iscritte alla facoltà di Medicina: 110.000 più del doppio rispetto a tutti gli altri paesi analizzati nello studio.,OBJ
"I francesi sono generosi per quanto riguarda il diritto alle vacanze, offrendo fino a 34 giorni di ferie all’anno, secondi solo alla Slovenia con 35 giorni di ferie all’anno.",OBJ
L’Olanda e la Finlandia occupano la seconda e la terza posizione tra i paesi con le maggiori opportunità.,OBJ
Le donne impiegate nel settore sanitario in Olanda lavorano solo 25 ore alla settimana (l’orario lavorativo più corto in Europa) e ricevono un salario annuale medio di 42mila euro.,OBJ
"La Finlandia è il quarto paese con la percentuale maggiore di donne impiegate nel settore sanitario (86%), preceduta dalla Romania e seguita dal Belgio.",OBJ
L’Italia si classifica ottava tra i paesi peggiori per le donne nelle professioni sanitarie.,OBJ
"Con un divario salariale del 24% nei confronti degli uomini, la sanità italiana ha ancora una lunga strada da fare per raggiungere la parità di genere.",SUBJ
"La Svizzera è quella che offre la paga più alta pari a 72mila euro, seguono a ruota Islanda e Lussemburgo con cifre simile.",OBJ
Fanalino di coda il Regno Unito.,OBJ
I paesi europei con che offrono pari opportunità salariali sono invece Romania e la Svezia con un divario salariale che si ferma all’11%.,OBJ
Lo stop sugli spostamenti tra regioni scade il 15.,OBJ
Il nodo sul tavolo di Draghi,OBJ
Il Governo Conte dovrebbe lasciare la scelta al nuovo esecutivo che,OBJ
Prorogare o meno il divieto di spostamenti tra Regioni: dovrebbe essere questa la prima decisione che il nuovo governo guidato da Mario Draghi sarà chiamato a prendere.,SUBJ
Il 15 febbraio scade infatti il decreto legge Covid che dispone il blocco degli spostamenti anche tra Regioni gialle.,OBJ
"Per l'eventuale proroga serve un decreto legge, non basta un Dpcm o un'ordinanza del ministro della Salute.",OBJ
"Il governo Conte è ancora in carica per gli affari correnti e in teoria potrebbe adottarlo ma la scelta, spiegano diverse fonti governative, sarà più probabilmente lasciata al nuovo esecutivo:",OBJ
"se non si allungheranno i tempi per la sua formazione, entro il fine settimana potrebbe infatti giurare e dunque essere in carica",OBJ
"I tempi sono invece più lunghi per il prossimo Dpcm, che disegna il quadro normativo delle misure anti contagio:",OBJ
"scade il 5 marzo il decreto del presidente del Consiglio attualmente in vigore, con la divisione delle Regioni in fasce di rischio (gialla, arancione e rossa), il coprifuoco e la chiusura di bar e ristoranti alle 18.",OBJ
"Bisognerà vedere cosa deciderà il nuovo esecutivo guidato da Draghi, che secondo alcune previsioni potrebbe giurare prima di venerdì, proprio il giorno del monitoraggio settimanale della cabina di regia e delle eventuali ordinanze del ministro della Salute.",OBJ
"""Sarà il nuovo governo a fare una valutazione, sulla base del quadro epidemiologico, sulla mobilità tra le Regioni nelle diverse fasce e in particolar modo in fascia gialla, anche perché eventuali misure limitative necessitano di un apposito decreto"".",OBJ
aveva detto giorni fa il ministro uscente degli Affari regionali Francesco Boccia,OBJ
"La fine del divieto di spostamento tra regioni viene invocata tra gli altri dai gestori di impianti sciistici, la cui riapertura, ma solo nelle zone gialle, è stata già avallata dal Comitato tecnico scientifico e prevista proprio per il 15 febbraio.",OBJ
"Impeachment, Trump accusato di alto tradimento:",OBJ
La sua responsabilità inequivocabile',SUBJ
La difesa:,OBJ
Il Senato non ha più giurisdizione su di lui'.,OBJ
"Lite con gli avvocati per la parcella, l'accordo iniziale era per 250 mila dollari poi schizzati a 3 milioni",OBJ
"""Un tradimento di proporzioni storiche"":",OBJ
così i manager dell'accusa descrivono la condotta di Donald Trump.,OBJ
"""Ha messo in pericolo la vita di tutti i membri del Congresso istigando i supporter alla rivolta caricandoli come un cannone puntato sul Campidoglio""",OBJ
si legge.,OBJ
"""Ha inoltre minacciato il sistema costituzionale che protegge le libertà fondamentali, messo a repentaglio un pacifico passaggio dei poteri e compromesso la sicurezza nazionale"".",OBJ
Tutto ciò costituisce una violazione costituzionale che legittima l'esclusione da qualunque futuro incarico federale.,OBJ
concludono i manager,OBJ
"La ""responsabilità individuale"" di Donald Trump per gli eventi del 6 gennaio che hanno portato all'assalto del Congresso ""è inequivocabile""",SUBJ
lo affermano i manager che rappresenteranno l'accusa nel corso del processo per impeachment dell'ex presidente americano che vedrà il via la prossima settimana.,OBJ
"""Trump ha minacciato il sistema costituzionale istigando la rivolta e la sua condotta deve essere dichiarata inaccettabile nei termini più chiari e assoluti"",",OBJ
"affermano i manager, sottolineando come all'ex presidente",OBJ
"""dovrebbe essere vietato di ricoprire futuri incarichi pubblici"".",OBJ
"""Il Senato non ha più giurisdizione su Donald Trump"":",OBJ
"è la linea della difesa dell'ex presidente americano che replica ai manager dell'accusa definendo l'articolo di impeachment ""errato"".",OBJ
I disaccordi sulla strategia non sono stati l'unico motivo per cui il team legale incaricato di difendere Donald Trump nel processo di impeachment si è sgretolato a pochi giorni dall'inizio del dibattimento.,OBJ
"Secondo Axios, l'ex presidente e il capo della squadra di legali, l'avvocato Butch Bowers, hanno litigato per una questione di soldi.",OBJ
"I due inizialmente avevano concordato una parcella di 250.000 dollari per la difesa, ma Bowers non aveva incluso molte spese aggiuntive, tra cui nuovi legali e ricercatori impegnati nello studio del caso, che hanno fatto schizzare la parcella a 3 milioni di dollari, il che ha fatto infuriare Trump.",OBJ
"La disputa sul denaro si è aggiunta quindi alle divergenze sulla strategia, che The Donald voleva - a differenza degli avvocati - incentrare sulla teoria dei brogli elettorali.",OBJ
"""Queste persone non sono più rilevanti.",OBJ
"Abbiamo i nostri avvocati, abbiamo una squadra solida e guardiamo avanti"",",OBJ
ha detto ad Axios il consulente di Trump Jason Miller.,OBJ
I cospirazionisti di Qanon alla testa degli assaltatori,OBJ
"Le corna, il cappello di pelliccia, i tatuaggi.",OBJ
"L'""Attila"" del Campidoglio è diventato il volto simbolo del drammatico attacco al Congresso americano di ieri.",SUBJ
"L'uomo che si vede nei video e nelle immagini diffusi dai fan di Donald Trump che hanno fatto irruzione nel cuore delle istituzioni si chiama Jake Angeli, 32anni, di Phoenix (Arizona).",OBJ
"Si tratta di un aspirante attore, performer e attivista, difficile capire dove finisca un ruolo e inizi l'altro.",SUBJ
Fatto sta che è un personaggio molto noto della galassia dei duri e puri del presidente.,OBJ
"Jake Angeli è stato il primo ieri a penetrare alla guida di un drappello di suoi “fedelissimi"" all’interno dell’aula del Congresso prendendo il posto destinato al vice presidente americano Mike Pence. ",SUBJ
Il suo nome è associato alla teoria cospirazionista QAnon che vuole il mondo alla mercé di una massoneria di pedofili satanisti alla quale solo Trump può opporsi.,OBJ
"""Q sent me!"", Q mi ha mandato, era la scritta sul cartello di Angeli chiamato anche ""QAnon Shaman"", sciamano QAnon.",OBJ
"Anche Ashli Babbit, la donna uccisa nel Congresso Usa, era un'attivista QAnon che usava su twitter il nickname di CommoashSense.",OBJ
La donna aveva una bandiera pro Trump e dopo essere stata colpita è caduta a terra.,OBJ
"Babbit, veterana dell’aeronautica titolare di un’attività a San Diego, era andata a Washington senza il marito.",OBJ
Sono stati colpi di arma da fuoco sparati con l'arma d'ordinanza da un poliziotto in divisa a ucciderla.,OBJ
"Nelle strade di Washington sono stati fotografati i Proud Boys e i Boogaloo, altri gruppi dell’ultradestra ben noti negli Usa, ma anche esponenti dei vecchi Tea Party come Kylie Jane Kremer e leader di gruppi anti-mascherine e negazionisti del Covid.",OBJ
"Un mix esplosivo che, davanti a Capitol Hill, è deflagrato nella drammatica protesta che ha incollato tutto il mondo davanti a siti e televisioni.",SUBJ
Pasta dal sapore littorio e dal gusto coloniale?,SUBJ
La Molisana: nessuna volontà di celebrare il fascismo,SUBJ
"Non potevano non scatenare infinite polemiche, anche di natura squisitamente politica e non culinaria, i nuovi formati di pasta de La Molisana, con descrizione di Abissine e Tripoline, formati di pasta nati negli anni trenta e definiti addirittura di ""sapore coloniale"".",SUBJ
"Il fantastico mondo del web, a volte lontano anni miglia dal mondo reale, si infiamma dopo che un consumatore della pasta La Molisana nel recarsi al supermercato per acquistare della pasta a forma di conchiglia si imbatte in una etichetta che, a suo dire, non sembrerebbe in linea addirittura con la democrazia (sicuramente non con il politicamente corretto).",SUBJ
Il consumatore esprime tutta la sua amarezza sul web con un post:,OBJ
"""non compererò più pasta 'La Molisana'.",OBJ
"Ho scopeto che ha un tipo di pasta che si chiama 'Abbissina' un nome che è già uno story-telling ed è descritta come di sicuro sapore littorio"".",OBJ
"Rossella Ferro, responsabile marketing dell'azienda molisana, ha ribadito che l'azienda non ha alcuna intenzione di celebrare il periodo storico delle colonie con queste parole che riportiamo fedelmente.",OBJ
"""Non abbiamo alcun intento celebrativo quando parliamo di questi formati storici, nati negli anni ’30.",OBJ
E infatti abbiamo appena provveduto a cambiare le schede descrittive dei prodotti.,SUBJ
Siamo molto attenti alla sensibilità dell’opinione pubblica e in questo caso l’unico errore è stato non ricontrollare tutte le schede affidate all’agenzia di comunicazione.,SUBJ
E invece è la conferma che non si può perdere di vista nemmeno un dettaglio.,OBJ
"Ribadisco che per noi non c’è alcun sentimento di celebrare quel periodo storico"".",OBJ
Marilyn Manson mollato da etichetta discografica,OBJ
"Marilyn Manson all'indice: l'etichetta discografica Loma Vista che aveva distribuito i suoi ultimi album lo ha messo alla porta dopo che l'attrice di ""Westworld"" Evan Rachel Wood lo ha accusato di ""orrendi"" atti di violenza domestica.",OBJ
"""Alla luce delle accuse della Wood e di altre donne smetteremo di promuovere il suo ultimo album e non avremo piu' rapporti con lui in futuro"",",OBJ
ha detto un portavoce all'Hollywood Reporter.,OBJ
"L'annuncio fa seguito a un post della Wood su Instagram in cui l'attrice ha raccontato che Manson ha abusato di lei per anni dopo averla ""adescata"" quando era ancora teen-ager:",OBJ
"""Esco allo scoperto per mettere in guardia le molte industrie che lavorano con lui prima che rovini altre vite"".",OBJ
"Dopo l'attrice, candidata a un Golden Globe per ""Westworld"" nel 2017 e prima ancora, nel 2003, per ""Thirteen"", altre quattro donne si sono fatte avanti per accusare il cantante di ""Tainted Love"" di simili violenze e abusi. ",OBJ
