Sentence,Label
"In pericolo, insomma, “c’è la libertà della Chiesa e la libertà dei credenti di vivere secondo la loro coscienza"". ",SUBJ
"Se non fosse chiaro, “per i vescovi della nazione la continua ingiustizia dell’aborto rimane la priorità preminente"". ",SUBJ
"Tutto il resto, dunque, viene dopo. ",OBJ
Un bel problema.,OBJ
BOMBA SOCIALE,OBJ
"Nel giorno dell’anniversario della conquista del voto in Italia le donne si sitrovano in un triste primato, sono ancora loro a pagare la crisi. ",SUBJ
Ad attestarlo è l’Istituto italiano di Statistica.,OBJ
"Nonostante il blocco dei licenziamenti, calano in modo spaventoso le occupazioni, soprattutto sul versante femminile. ",SUBJ
"I lavoratori scendono di 101 mila unità, ma di questi 99 mila sono donne e sono 2000 sono uomini. ",OBJ
Tra i settori in calo soprattutto gli autonomi: nel solo mese di dicembre si perdono 79 mila posti di lavoro rispetto a novembre.,OBJ
"Il tasso di occupazione delle donne a dicembre cala di 0,5 punti e cresce quello di inattività (+0,4 punti), per gli uomini al contrario la stabilità dell’occupazione si associa al calo dell’inattività (-0,1 punti). ",OBJ
"In generale, c’è un forte aumento dell’inattività ma solo per la fascia dei età giovanile e per quella centrale.",OBJ
“I dati ISTAT sull’occupazione sono molto preoccupanti e con lo sblocco dei licenziamenti la situazione non potrà certo migliorare.,SUBJ
"Calano gli occupati rispetto al mese di dicembre 2019 di circa 450mila unità, per di più donne. ",OBJ
Il dato ancora più drammatico è il crollo dell’occupazione indipendente.,SUBJ
È fondamentale invertire la rotta: il nuovo Governo dovrà affrontare una tragica situazione lavorativa e mettere in campo misure straordinarie per l’occupazione.,SUBJ
"Anche per questo noi socialisti abbiamo chiesto che nel nuovo patto di legislatura venga inserita l’assunzione di 500mila giovani diplomati e laureati da destinare alla valorizzazione dei beni culturali, del turismo, della pianificazione e del digital marketing, attraverso l’utilizzo di una parte dei fondi del Recovery Plan."" ",OBJ
"È quanto dichiara in una nota il Segretario del Psi, Enzo Maraio.",OBJ
"I disoccupati complessivi sono 2.257.000 con un aumento di 34.000 unità su novembre e un calo di 222,000 su dicembre 2019. ",OBJ
Il dato risente del largo utilizzo della cassa integrazione e del blocco dei licenziamenti oltre che dall’uscita dal mercato del lavoro delle persone che non hanno fiducia nella possibilità di trovare un lavoro.,OBJ
Gli inattivi sono 13.759.000 e crescono di 42.000 unitaà su novembre di 482.000 unità su dicembre 2019.,OBJ
"Nel confronto annuo si perdono 444 mila unità, mentre le fila degli inattivi crescono di 482 mila unità. ",OBJ
"Anche in questo caso, c’è una forte prevalenza femminile, anche se meno marcata rispetto al confronto tra novembre e dicembre: infatti le donne passano da 9,842 milioni del dicembre 2019 a 9,530 milioni a dicembre 2020, in 312 mila perdono il lavoro, mentre gli uomini passano da 13,441 milioni a 13,309, perdendo 132 mila unità. ",OBJ
"La maggiore fragilità del lavoro femminile è dovuta al fatto che in percentuale le donne sono maggiormente occupate nei servizi, in lavori precari o per i quali è possibile licenziare (a cominciare dal lavoro domestico).",OBJ
"“Sono dati che non sorprendono e purtroppo evidenziano un rischio sempre più imminente: se a primavera non verrà prorogato il blocco dei licenziamenti saremo di fronte a una vera e propria bomba sociale"". ",OBJ
Così la segretaria confederale della Cgil Tania Scacchetti commenta le rilevazioni su occupati e disoccupati diffuse quest’oggi dall’Istat.,OBJ
"“Donne, giovani, lavoratori autonomi – afferma la dirigente sindacale – hanno già pagato un prezzo altissimo, destinato a salire qualora non si mettano in campo strumenti straordinari e innovativi per governare la fase di transizione che verrà determinata dall’onda lunga della crisi"".",OBJ
"Per questo, prosegue Scacchetti, “chiediamo di riformare subito il sistema di protezioni sociali. ",OBJ
"Dobbiamo rilanciare il contratto di solidarietà difensiva e – sottolinea – creare un sistema universale di sostegno al reddito che non lasci indietro nessuno, a partire dai lavoratori con contratti precari e discontinui"". ",OBJ
"Inoltre, continua la segretaria confederale, “la proroga del blocco dei licenziamenti serve a garantire le condizioni per individuare in modo condiviso soluzioni e interventi capaci di evitare un impatto sociale che rischia di essere drammatico"". ",OBJ
Infine “come da noi proposto anche nelle audizioni sul Recovery Plan occorre un piano straordinario di investimenti che abbiano come obiettivo principale la creazione di nuova occupazione.,OBJ
"Non si può costruire la ripresa sulle macerie del lavoro"", conclude Scacchetti.",OBJ
"“L’effetto pandemia si sta abbattendo con maggior virulenza su giovani e donne, quelli su cui gravano maggiormente contratti instabili. ",OBJ
"Ci chiediamo perché in ogni crisi che attraversa questo Paese, sono sempre questi due target di popolazione a subire i maggiori contraccolpi in termini occupazionali?",SUBJ
"Sure, Next Generation UE e risorse nazionali, sono un’enorme mole di risorse da non disperdere in mille rivoli, ma in chiari, lungimiranti, efficaci obiettivi mirati alla ripresa del Paese finalizzata, in primis, ad un’occupazione migliore"", dice Ivana Veronese, Uil.",OBJ
"Bihac, lo scaricabarile che non salva nessuno",SUBJ
"Ormai le riprese televisive e i reportages giornalistici hanno mostrato a tutto il mondo l’indegna e vergognosa situazione in cui migliaia di profughi sono ridotti a Bihac, in Bosnia Erzegovina. ",SUBJ
"Vedere donne e bambini, uomini di tutte le età affrontare all’aperto il gelo (le temperature toccano anche i venti gradi sottozero), camminare con scarpe di fortuna e anche senza tra le neve, dormire in tende o in campi raccolta privi di impianti igienici e di riscaldamento adeguati e spesso neanche in quelli ma all’addiaccio, hanno provocato nell’opinione pubblica europea un forte sentimento di sbigottimento e riprovazione. ",OBJ
Se ne sono accorti anche i quattro europarlamentari italiani del gruppo Socialisti e Democratici che sabato e domenica hanno visitato questi territori.,OBJ
"I quattro hanno cominciato dalla Croazia, anzi volevano incominciare ma hanno trovato sul loro percorso la polizia di Zagabria che non ha permesso loro di accedere nella parte croata della foresta di Bonja, ufficialmente per la presenza di mine antiuomo ( inesistenti), probabilmente per nascondere quella parte di area, al confine con la Bosnia dove centinaia di disperati cercano di introdursi illegalmente per poi raggiungere la Slovenia e quindi l’Italia attraversando il Carso nella provincia di Trieste. ",SUBJ
Migranti che vengono malmenati e picchiati dai poliziotti croati (secondo denunce di varie associazioni umanitarie ma anche al centro di un’inchiesta dell’Unione Europea) e poi rispediti in Bosnia.,SUBJ
"I quattro poi sono riusciti a proseguire per Bihac, dove hanno potuto vedere con i loro occhi la gravità della situazione. ",OBJ
Sulla condizione disumana in cui vivono i migranti è in atto uno scaricabarile che non salva nessuno.,SUBJ
La verità è che manca una vera strategia e che si vive alla giornata.,OBJ
"L’Unione Europea tramite Josep Borrell , Alto rappresentante per la politica estera e la sicurezza , se la prende con il Governo federale di Sarajevo, dicendo che non ha fatto nulla, nonostante ingenti aiuti finanziari ,per risolvere i problemi e anzi quasi lo ricatta annunciando che ciò allontanerà il cammino di adesione all’ Europa. ",OBJ
"Per la verità Sarajevo, dopo un incendio che aveva danneggiato il campo profughi di Lipa, ha inviato l’ esercito a realizzare una tendopoli, peraltro insufficiente. ",OBJ
Ma è proprio sulla gestione dei campi di raccolta che è divampata una polemica che ha fatto perdere tempo prezioso e determinato lo scoppio della situazione tragica di oggi.,SUBJ
"Infatti lo Iom (International Organisation for Migrants) che riceve le risorse finanziarie da Bruxelles, ha privilegiato la ristrutturazione del campo di Bira, situato al centro della città e che le autorità locali vogliono chiudere perché inviso ai cittadini che non sopportano più, per problemi di delinquenza e sicurezza, la presenza dei migranti sulle strade di Bihac. ",OBJ
"Il Sindaco, appena rieletto, Suhret Fazljc, spalleggiato dal Cantone, punta invece al ripristino di quello di Lipa, a circa trenta chilometri dal centro. ",OBJ
"È auspicabile che la nuova responsabile dello Iom, l’italiana Laura Lungarotti, agisca in sintonia con le autorità locali. ",OBJ
Anche nel nostro Paese si registrano reazioni rispetto a quanto sta accadendo.,OBJ
"Se da un lato il Presidente della Regione FVG Massimiliano Fedriga chiede un rafforzamento della vigilanza sul confine per fermare l’arrivo dei clandestini, dall’ altra un tribunale giudica illegittimo il respingimento in Slovenia dei migranti richiedenti asilo, respingimento derivato da un accordo specifico tra Roma e Lubiana. ",OBJ
Fino all’Odg approvato dal Consiglio comunale di Bondeno( Ferrara) che minaccia di interrompere il gemellaggio con Bihac se proseguirà il disastro umanitario.,SUBJ
Come se il comune di Bihac avesse la responsabilità principale e non fosse invece una parte lesa.,SUBJ
Mentre migliaia di disperati continuano la loro agonia.,SUBJ
Le verità scomode dell’era Craxi la verità che va oltre la cronaca,SUBJ
"“La libertà equivale alla mia vita"".",OBJ
Il ventennale della morte di Bettino Craxi celebratori nel gennaio del 2020 ha messo in scena il paradosso della memoria del segretario del partito socialista.,OBJ
Lo scrive sul Corriere della Sera,OBJ
Soprattutto durante l’affollata commemorazione al cimitero di Hammamet dove campeggia questa frase che è ancora oggi un monito pesante per la storia italiana.,OBJ
"Giulio Santarelli già sottosegretario nel primo governo Craxi è autore di un libro documentario, denso e appassionato, Le verità scomode. ",SUBJ
Craxi e e i socialisti al governo.,OBJ
"Crescita sviluppo e benessere per gli italiani, in cui con coerenza e fedeltà alle sue radici si prefigge di demolire la montagna di menzogne e di falsità che ci vengono rivolte a trent’anni dalla conclusione del governo Craxi ed esplicita quel paradosso con le stesse parole di Craxi: ",SUBJ
“Sono certo che la storia condannerà i miei assassini.,OBJ
"Solo una cosa mi ripugnerebbe: essere riabilitato da coloro che mi uccideranno"".",OBJ
"Libia, ancora nulla di fatto dopo l’accordo",OBJ
"Sono passati più di cinque mesi dall’accordo tra il Capo del Governo libico riconosciuto Serray e il Presidente della Camera di Tobruk Saleh che ha sancito, con il beneplacito di Turchia e Russia e la mediazione americana, il cessate il fuoco e l’auspicabile fine della guerra civile ma, a parte la sospensione dei combattimenti salvo sporadiche scaramucce, nulla è stato fatto di quello che l’accordo prevedeva. ",OBJ
Sono invece cambiati gli interlocutori.,OBJ
"Sul fronte della Tripolitania , al posto di Serray, che aveva dichiarato di volersi dimettere lo scorso ottobre ma che è ancora al suo posto si delineano le figure di Fathi Bashagha, Ministro dell’Interno prima sospeso e poi reintegrato che controllava una parte del Gna, l’esercito di Tripoli, e di Ahmed Maitig, Vicepresidente dell’Esecutivo e, in attesa delle dimissioni di Serray, punto di riferimento per la relazioni internazionali. ",OBJ
"Sul fronte opposto pare offuscata la posizione di Saleh, mentre è rientrato completamente in gioco il generale Haftar, troppo presto dato per ridimensionato. ",SUBJ
"A ciò ha contribuito anche il nostro Paese che, con il viaggio di Conte e Di Maio a Bengasi per ringraziarlo della liberazione dei pescatori di Mazara del Vallo dopo due mesi di prigionia, gli hanno restituito credibilità e rappresentanza politica.",OBJ
"E questa riabilitazione si è confermata nei giorni scorsi quando il direttore dei nostri servizi segreti (Aise) Gianni Caravelle, si è recato a Bengasi per incontrarlo e la notizia è stata ampiamente diffusa dai media controllati da Haftar. ",OBJ
"Chissà cosa ne ha pensato Stephanie Williams, rappresentante speciale dell’ONU per i negoziati di pace che avevano esautorato Haftar dalle trattative. ",SUBJ
Certo è che sugli impegni che dovevano seguirà l’accordo di cinque mesi fa praticamente nulla è stato fatto.,SUBJ
I due eserciti dovevano abbandonare le posizioni sul fronte e tornare alle loro basi e invece sono tutt’ora posizionati come prima.,OBJ
"Il punto più critico è a Siete, per il cui controllo sono stati bloccati i combattimenti ma proprio da quella località i mercenari russi alleati di Haftar hanno costruito una serie di fortificazioni che sembrano più una preparazione per la ripresa del conflitto che una proiezione futura della pace. ",SUBJ
"I mercenari siriani dalla parte di Tripoli e russi da quella di Bengasi, ché ho dovevano essere fatti rientrare nelle zone di provenienza, sono tutt’ora posizionati a fianco del due eserciti libici. ",OBJ
"Non parliamo poi delle truppe turche che in terra e con le navi da guerra nel Mediterraneo, continuano a supportare Serray. ",SUBJ
Come continuano le attività di addestramento da parte di istruttori stranieri.,OBJ
In questa situazione sembra fantascienza pensare a ciò che prevedeva la parte finale dell’accordo Serray Saleh e cioè un referendum su una nuova Costruzione e libere elezioni in tutto il Paese entro il dicembre 2021.,SUBJ
"A questi problemi poi se ne sono aggiunti altri, derivati come già detto, dalle divisioni interne sia Tripoli che a Bengasi, con il pericolo di rese dei conti anche sanguinose. ",OBJ
Si attende inoltre di vedere quale sarà l’atteggiamento del nuovo Presidente americano Joe Biden e se sarà confermato il sostanziale disimpegno voluto da Trump.,OBJ
Di certo attualmente vi è solo il sostanziale patto di spartizione territoriale tra Russia e Turchia che riguarda anche lo sfruttamento del patrimonio petrolifero libico.,SUBJ
Con l’Italia che tenta di recuperare il suo tradizionale e storico ruolo ormai però ridotto attualmente a quello di osservatore passivo.,OBJ
IL GIORNO DOPO,OBJ
"Il giorno dopo dichiarazioni e smentite dei gruppi politici per un nuovo Governo Draghi le consultazioni vanno avanti, oggi l’incontro a Montecitorio con il gruppo Maie del Senato e Leu, Iv, Fdi, Pd e Fi. ",OBJ
Domattina sono attesi Lega e M5s.,OBJ
"E mentre il presidente incaricato incassa la fiducia di ITalia Viva e molti dubbi da Leu che non vorrebbe entare in un esecutivo con la Lega, la partita più importante resta quella con il Movimento 5 stelle, atteso dalle consultazioni nella giornata di sabato. ",OBJ
"Al meeting fra i pentastellati e Draghi potrebbe partecipare anche Beppe Grillo, arrivato a Roma per seguire da vicino i giorni caldi della crisi di governo. ",OBJ
"Dopo il no iniziale, sono sempre più consistenti i segnali distensivi da M5s, corroborati anche dal ‘discorso del tavolino’ di Conte.",OBJ
Intanto a Roma è giunto anche Davide Casaleggio: ha sostenuto che c’è consenso per far passare da un voto degli iscritti a Rousseau la possibilità di appoggiare un governo guidato dall’ex presidente Bce.,OBJ
"Forza Italia fa sapere che il presidente Silvio Berlusconi non potrà partecipare oggi, suo malgrado, alle consultazioni del Presidente incaricato. ",OBJ
"Lo ha comunicato lui stesso al professor Mario Draghi, in un lungo e cordiale colloquio telefonico, nel quale gli ha espresso il suo rammarico – spiega FI -, e gli ha anticipato la posizione di Forza Italia che gli sarà illustrata nel pomeriggio dalla delegazione composta dal vicepresidente Tajani e dalle capigruppo Bernini e Gelmini. ",OBJ
"Forza Italia non metterà paletti, così come il Pd, con il segretario Nicola Zingaretti che ha annunciato che non metterà paletti al perimetro della maggioranza perché è “compito di Draghi"", mentre i dem “offriranno i contenuti"". ",OBJ
E sulla situazione nella quale Matteo Renzi ha costretto il suo ex partito scatenando la crisi ha sottolineato:,OBJ
"“Ricordo che il giorno del giuramento del Conte 2 Renzi fondò un partito con l’obiettivo dichiarato di distruggere il Pd, noi oggi cresciamo mentre il partito di Renzi è inchiodato al 1,5-2 per cento"".",OBJ
"Il Quirinale segue con attenzione, seppur a debita distanza, l’evoluzione della situazione politica dopo l’incarico a Mario Draghi. ",OBJ
Il presidente Sergio Mattarella ovviamente osserva il dispiegarsi delle diverse dichiarazioni che si susseguono da tutte le forze politiche.,OBJ
In queste ore al Colle si registra un moderato ottimismo sulla possibilità di una soluzione della crisi.,OBJ
"Speranza: massima prudenza, la zona gialla non è scampato pericolo.",OBJ
Nuovo picco di ricoverati Covid in Umbria,OBJ
Iss: sulle varianti il rigore delle protezioni ma non cambia la strategia,OBJ
"""Serve massima prudenza su tutto il territorio nazionale. ",OBJ
"Non dobbiamo vanificare i progressi delle ultime settimane, risultato dei sacrifici fatti finora.",SUBJ
Zona gialla non significa scampato pericolo.,OBJ
"Il virus circola e il rischio, anche per via delle varianti, resta alto. ",OBJ
"Non possiamo scherzare con il fuoco"". ",OBJ
"Questo l'appello del ministro della Salute, Roberto Speranza, pubblicato su Facebook.",OBJ
"Nuovo picco di ricoverati Covid in Umbria, oggi 484, 26 più di ieri, secondo quanto riporta il sito della Regione.",OBJ
"I pazienti in terapia intensiva sono 73, più tre.",OBJ
"I nuovi positivi accertati nell'ultimo giorno sono 382, più 8,8 per cento su ieri, i guariti 177, e tre i morti, 834. ",OBJ
"Gli attualmente positivi raggiungono quota 6.784, 202 in più di ieri. ",OBJ
"Analizzati, sempre nell'ultimo giorno 3.611 tamponi e 4.010 test antigenici.",OBJ
"Il tasso di positività totale è del 5 per cento, 10,57 per cento sui soli antigenici (ieri 8,2%).",OBJ
Iss: sulle varianti rigore protezioni ma non cambia strategia,OBJ
"Al momento non sono emerse evidenze scientifiche della necessità di cambiare le misure, che rimangono quindi quelle già in uso: mascherine, distanziamento sociale e igiene delle mani. ",OBJ
"La possibilità di venire in contatto con una variante deve comunque indurre particolare prudenza e stretta adesione alle misure di protezione"". ",OBJ
Lo scrive l'Iss che ha stilato le Faq sul tema varianti.,OBJ
E sui test per individuarle:,OBJ
"Per potere discriminare se un'infezione è determinata da una variante è necessario un test specifico altamente specialistico che è detto sequenziamento, in cui si determina la composizione esatta del genoma del virus"".",OBJ
"9.660 nuovi contagi, 499 morti.",OBJ
«In Lombardia tutti vaccinati entro giugno».,SUBJ
"Lo promette Bertolaso, neo nominato consulente per la campagna vaccinale della Regione: da fine febbraio si comincerà con gli over 80.",OBJ
"Sono 9.660 i nuovi contagi registrati nelle ultime 24 ore, mentre i morti risultano 499.",OBJ
"Ieri i test positivi erano stati 7.925, i morti 329.",OBJ
"Nel complesso sono stati 244.429 i test (tamponi molecolari e antigenici) effettuati, con un tasso di positività rispetto ai nuovi casi (9.660) pari al 3,9%, in calo dell'1,7% rispetto a ieri.",OBJ
"“Con una campagna massiccia di vaccinazione 24 ore al giorno 7 giorni a settimana, se abbiamo i vaccini il traguardo di vaccinare tutta la Lombardia prima della fine di giugno è assolutamente possibile"":",OBJ
"lo ha detto Guido Bertolaso, neo arruolato dalla Regione per il comitato guida della gestione del piano vaccinale anti-Covid.",OBJ
"""Nei prossimi giorni coinvolgeremo tutti i soggetti che potranno dare una mano per vaccinare 10 milioni di persone auspicabilmente entro l'inizio dell'estate, prima di giugno, ma sempre se ci danno i vaccini.",OBJ
"Sono convinto che ce la faremo"".",OBJ
ha detto,OBJ
"""Avremo un febbraio e un mese di marzo critici per quanto riguarda l'approvvigionamento, ma da aprile in poi saremo inondati di vaccini""",OBJ
"ha detto ancora Bertolaso, il quale ha precisato anche che per la consulenza non riceverà alcun compenso.",OBJ
"Per gli ultraottantenni, che in Lombardia sono 700mila, la vaccinazione dovrebbe partire entro fine febbraio.",OBJ
"spiega Giacomo Lucchini, responsabile della campagna vaccinale della Lombardia, ",OBJ
""" Per prenotarsi, abbiamo in funzione il canale dei medici di base, che conoscono meglio questa popolazione, e abbiamo dei sistemi di prenotazione, sia con chiamata che con invito"".",OBJ
"In contemporanea, con il vaccino di AstraZeneca (da riservare agli under 55), cominceranno le vaccinazioni di massa a partire dal personale scolastico e dei servizi.",OBJ
"La Campania: vaccini finiti, già prenotati 50mila ultraottantenni",OBJ
"""Qualche tempo fa si diceva che la Lombardia è un modello, ma oggi...",OBJ
Come Campania siamo la prima regione d'Italia per la percentuale di,OBJ
"Il treno della Campania è alta velocità, lì stanno ancora con l'accelerato"".",OBJ
"A fare il confronto è il presidente della Regione Campania, Vincenzo De Luca.",OBJ
"""Oggi chiudiamo la seconda dose ma i vaccini sono finiti""",OBJ
informa.,OBJ
E anche lui si dà una scadenza:,OBJ
"""Abbiamo l'obiettivo di vaccinare 4,6 milioni di cittadini nel 2021 e l'obiettivo intermedio di vaccinare tutti cittadini di Napoli entro l'estate ma ci devono arrivare i vaccini"".",OBJ
"""Noi siamo pronti, possiamo fare anche 50.000 vaccini al giorno. ",OBJ
ha detto,OBJ
"Fra qualche giorno cominciamo a vaccinare gli ultraottantenni e poi le categorie fragili, come i malati oncologici, gli immunodepressi, con livelli di efficienza che ci invidiano"".",OBJ
"Al terzo giorno di apertura della piattaforma telematica per l'adesione al piano vaccinazioni riservato ai cittadini campani che hanno 80 anni di età o più, è stata già superata quota 50mila iscritti.",OBJ
Il link per prenotarsi è https://adesionevaccinazioni.soresa.it/.,OBJ
Possono aderire anche coloro che compiono gli 80 anni in tutto il 2021.,OBJ
"Al momento dell'adesione è necessario fornire un indirizzo email e un recapito cellulare, che saranno utilizzati in fase di convocazione per la somministrazione della prima dose del vaccino.",OBJ
La piattaforma richiede la verifica del numero di cellulare fornito tramite un codice inviato via Sms.,OBJ
"Giornata della Memoria, i tre consiglieri di centrodestra a Cogoleto fanno il saluto romano.",OBJ
Lo sdegno dell'Anpi,OBJ
"Astenuti""?",OBJ
"""favorevoli?"",",OBJ
"""contrari""?",OBJ
Il presidente del consiglio comunale va alla chiama per il voto e dai banchi della minoranza si alzano le braccia tese come in un saluto romano.,OBJ
"È successo mercoledì 27 gennaio nel Giorno della Memoria,  a Cogoleto, comune di  quasi 9 mila abitanti della città metropolitana di Genova. ",OBJ
"Un gesto considerato gravissimo dal sindaco e dalla maggioranza di centrosinistra, ancor più grave perchè accaduto  il giorno in cui si ricordano le vittime della Shoah nazista.",OBJ
"Una ricorrenza che, evidentemente, non ha dissuaso i politici locali dai loro intenti.",SUBJ
"Dopo i saluti romani dei consiglieri Biamonti, Amedei e Siri, dentro e fuori dall’ aula è scoppiata la bagarre.",OBJ
"Le polemiche sono destinate a continuare nelle prossime ore, con interrogazioni urgenti e richiesta di scuse e dimissioni da parte dei tre consiglieri che si sono esibiti nel gesto nostalgico. ",OBJ
"""Un fatto inaudito, vergognoso e gravissimo, un vero e proprio oltraggio alle istituzioni e a Genova città medaglia d'oro al valore militare per la Resistenza. ",OBJ
" dice Massimo Bisca, presidente provinciale dell'Anpi di Genova.",OBJ
"“Chiediamo le dimissioni dei tre consiglieri e al sindaco di girare il video della seduta del consiglio alla magistratura"".",OBJ
conclude il presidente dell'Anpi,OBJ
"Draghi e i tatticismi, nome da proteggere .",SUBJ
Sono due le opportunità possibili per un recupero di credibilità da parte di una classe politica che appare ai minimi storici nel pieno della pandemia,SUBJ
"In ordine cronologico, la prima è stata offerta dall’ingresso in campo dell’Arbitro.",OBJ
"La regia del Quirinale ha segnato il passaggio dalle dichiarazioni via smartphone, rivolte ciascuno ai propri aficionados, al confronto avviato finalmente nelle sedi istituzionali, con colpevole ritardo e animi ormai esacerbati.",SUBJ
"Andata a vuoto questa, l’ultima opportunità, sotto forma di costrizione fuori tempo massimo, verrebbe imposta dallo spread e dalle ondate speculative che rischiano di abbattersi sul nostro già martoriato Paese se l’avvitamento su sé stessa della legislatura dovesse rivelarsi irrisolvibile.",SUBJ
"Una trattativa che resta dall’esito incerto, decisivo certamente sarà l’ultimo miglio.",SUBJ
"Nel frattempo però si registra la maldestra e diffusa tendenza di ritorno, di rivolgersi ai propri 'tifosi' con modalità diverse, mettendo in giro congetture, retropensieri, con l’ausilio della diffusione di notizie non verificate.",SUBJ
Ha comportato una smentita secca del Quirinale quella secondo la quale Mattarella nei giorni scorsi avrebbe pre allertato Mario Draghi.,OBJ
Sono state messe insieme una cosa vera e una non vera.,OBJ
È vero che l’ex presidente della Bce e l’attuale capo dello Stato sono legati da una stima e una sintonia profonda.,OBJ
"A nessuno sfugge, ad esempio, che nel messaggio di Capodanno le parole di Mattarella richiamavano quasi alla lettera la ricetta di Draghi.",SUBJ
"che ha auspicato una programmazione «concreta, efficace, rigorosa, senza disperdere risorse», volta a «superare fragilità strutturali».",OBJ
"Quel che non è vero però, ed è stato smentito, è che Mattarella abbia sentito Draghi in questi giorni in relazione diretta o indiretta con la crisi in atto.",OBJ
